,Filename,DocumentID,ESTC_ID,Date,Title,Vol_Number,Author,Imprint,Field_Headings,fn_pages,nofn_pages,TableName,fn.percent,decade,footnotes_present,tags,,
5013,1010301302.xml,1010301302,T200769,1773,"The life and opinions of Tristram Shandy, gentleman. |...",Volume 2,"Sterne, Laurence","Dublin : printed by Henry Saunders, in Great Ship-Street, near Stephen-Street, MDCCLXXIII. [1773].","Fiction, Authorship, Fiction",1,65,Manifest_LitAndLang1,0.015151515,1770,1,FN,"C, IT, MT",
5014,1010301303.xml,1010301303,T200769,1773,"The life and opinions of Tristram Shandy, gentleman. |...",Volume 3,"Sterne, Laurence","Dublin : printed by Henry Saunders, in Great Ship-Street, near Stephen-Street, MDCCLXXIII. [1773].","Fiction, Authorship, Fiction",1,74,Manifest_LitAndLang1,0.013333333,1770,1,FN,"IN, IT, MT",
5016,1010301305.xml,1010301305,T200769,1773,"The life and opinions of Tristram Shandy, gentleman. |...",Volume 5,"Sterne, Laurence","Dublin : printed by Henry Saunders, in Great Ship-Street, near Stephen-Street, MDCCLXXIII. [1773].","Fiction, Authorship, Fiction",1,61,Manifest_LitAndLang1,0.016129032,1770,1,FN,"IN, MT, IT",
5017,1010301306.xml,1010301306,T200769,1773,"The life and opinions of Tristram Shandy, gentleman. |...",Volume 6,"Sterne, Laurence","Dublin : printed by Henry Saunders, in Great Ship-Street, near Stephen-Street, MDCCLXXIII. [1773].","Fiction, Authorship, Fiction",1,56,Manifest_LitAndLang1,0.01754386,1770,1,FN,T,
5018,1010301307.xml,1010301307,T200769,1773,"The life and opinions of Tristram Shandy, gentleman. |...",Volume 7,"Sterne, Laurence","Dublin : printed by Henry Saunders, in Great Ship-Street, near Stephen-Street, MDCCLXXIII. [1773].","Fiction, Authorship, Fiction",1,59,Manifest_LitAndLang1,0.016666667,1770,1,FN,T,
5026,1012600300.xml,1012600300,T178781,1768,"The polite instructor; or, youth's museum. Consisting of moral essays, tales, fables, visions, and allegories. Selected from the most approved modern authors. With an introduction, containing rules for reading with elegance and propriety. To the whole is added, a collection of letters. With some rules prefixed, useful for supporting a genteel epistolary correspondence.",0,Anon,"Dublin : printed by John Exshaw, in Dame-Street, MDCCLXVIII. [1768].","Letter writing, Early works to 1800, Moral education, Early works to 1800, Young men, Conduct of life, Early works to 1800, Young women, Conduct of life, Early works to 1800, Young men, Intellectual life, Early works to 1800, Young women, Intellectual life, Early works to 1800",1,264,Manifest_LitAndLang1,0.003773585,1760,0,"TY, PB",,
5027,1012600401.xml,1012600401,T178169,1786,"Tales, romances, apologues, anecdotes, and novels; humorous, satiric, entertaining, historical, tragical and moral; from the French of the Abb<c3><a9> Blanchet, M. Bret, M. de la Place, M. Imbert, M. Saint Lambert, and the Chevalier de Florian. In two volumes. ...",Volume 1,Anon,"London : printed for G. G. J. and J. Robinson, Pater-Noster Row, MDCCLXXXVI. [1786].","French literature, Translations into English",1,293,Manifest_LitAndLang1,0.003401361,1780,1,FN,"C, T",
5029,1012700100.xml,1012700100,T164991,1749,"The adventures of Telemachus, the son of Ulysses. In twenty-four books. With the Adventures of Aristonous. Written by the Archbishop of Cambray. Done into English from the last Paris (which is the only genuine) edition, by Mr. Is. Littlebury and Mr. A. Boyer. With priviledge of his Majesty the King of Poland and Elector of Saxony. Reprinted at the second time according to the London's edition, and carefully purg'd of the errors of the former.",0,"F<c3><a9>nelon, Fran<c3><a7>ois de Salignac de La Mothe-","Iena : for Theodore William Ernest Guth, 1749.",French fiction,1,578,Manifest_LitAndLang1,0.001727116,1740,2,FN,"C, IT",
6240,1012800201.xml,1012800201,T189423,1790,The expedition of Humphry Clinker. By the author of Roderick Random. In two volumes. ...,Volume 1,"Smollett, Tobias George","Dublin : printed by the United Company of Book-Sellers, 1790.","Tobacco, Fiction",1,226,Manifest_LitAndLang2,0.004405286,1790,0,"RQ, CW ",,
5035,1013200100.xml,1013200100,T179860,1735,"Pinkethman's jests: or, wit refin'd. Being a new-year's gift for young gentlemen and ladies. In two parts. I. Containing a collection of moral, satyrical, and comical jests; Elegant and Witty Sayings; smart Repartees; fine Similies, Apothegms, surprizing Puns, with other curious Pieces on witty diverting Subjects; never before printed in any Collection whatever. II. Being a collection of comical songs, catches and dialogues; Pinkethman's Merry Prologues and Epilogues: Merry Elegies, Epitaphs, Epigrams, and Tales; Collected from the most Celebrated Authors. The whole Being an Agreeable Entertainment, adapted to the Conversation of People of the best Taste.",0,"Pinkethman, William","London : printed, and sold by John Atkinson, in Lincoln's-Inn-Square, [1735].",English wit and humor,1,276,Manifest_LitAndLang1,0.003610108,1730,1,FN,C,
5038,1013400500.xml,1013400500,T181356,1796,"Queen Mab; or fairy adventures: being a series of incidents wonderful and surprising: in which are painted the happiness attendant on virtue, and the punishment that necessarily follows vice, illustrated by Example.",0,Anon,"London : printed for William Lane, at the Minerva-Press, Leadenhall-Street, MDCCXCVI. [1796].","English fiction, 18th century",1,134,Manifest_LitAndLang1,0.007407407,1790,0,"TY, BQ, P",,
5050,1013701800.xml,1013701800,T169323,1703,"Ornatissimus joculator: or, the Compleat Jester. Containing, 1. celebrated jests, 2. merry jokes, 3. witty punns, 4. Notorious Bulls, 5. Pleasant Tales, And 6. Uncommon and Delightful Stories. Accurately collected, and plac'd under their Proper and Distinct Heads. To which is added, Wit's activity display'd: Instructing the meanest Capacity how to perform several Pieces of Art and Ingenuity to the Wonder and Admiration of the Spectators.",0,Anon,"London : printed by W. Onley, and sold by Eben. Tracy, at the three Bibles on London-Bridge, 1703.","Anecdotes, Early works to 1800, Puns and punning, Early works to 1800, English wit and humor, Early works to 1800, Aphorisms and apothegms, Early works to 1800",1,190,Manifest_LitAndLang1,0.005235602,1700,0,"SE, TY, LB",,
5056,1013900400.xml,1013900400,T166007,1785,"The English Roscius. Garrick's jests; or, genius in high glee. Containing all the jokes of the wits of the present age, viz. Mr. Garrick, Ld. Lyttleton, Mr. Fox, Ld. Mansf-, Mr. Burke, Mr. Foote, Mr. Selwyn, Dutchess of K. Lady H-, Lady T-, &c. Being Humorous, Lively, Comical Queer, Satirical Droll, Smart Repartees, Facetious, Merry Bon Mo[ll] &c. To which are added, a new selection of epigrams, poems, conundrums, toasts, sentiments, hob-nobs, &c. now in Fashion.",0,Anon,"London : printed for Charles Steele, Pater-Noster-Row, and A. Milne, opposite Bloomsbury Court, Holborn; and sold by all booksellers and newscarriers, [1785?].","English wit and humor, Early works to 1800",1,155,Manifest_LitAndLang1,0.006410256,1780,1,FN,C,
5063,1014100415.xml,1014100415,T194322,1765,"The works of Dr. Jonathan Swift, Dean of St. Patrick's, Dublin. Volume XV. Collected and Revised by Deane Swift, Esq. of Goodrich, in Herefordshire.",Volume 15,"Swift, Jonathan","London : printed for W. Johnston, in Ludgate-Street, MDCCLXV. [1765].","Swift, Jonathan,, 1667-1745",1,285,Manifest_LitAndLang1,0.003496503,1760,1,FN,IN,
5067,1014200202.xml,1014200202,T185980,1775,The expedition of Humphry Clinker. By the author of Roderick Random. In two volumes. ...,Volume 2,"Smollett, Tobias George","Dublin : printed by the United Company of Book-Sellers, 1775.","Tobacco, Fiction",1,224,Manifest_LitAndLang1,0.004444444,1770,1,FN,"IN, C",
6248,1014300200.xml,1014300200,T186233,1723,"Erasmi colloquia selecta: or the select colloquies of Erasmus with an English translation as literal as possible, design'd for the use of beginners in the Latin Tongue. Second edition. By John Clarke, Master of the publick Grammar School in Hull.",0,"Erasmus, Desiderius","York : printed by Charles Bourne, and soldby [sic] T. Ryles Book-Seller in Hull, A. Bettesworth in Pater-Noster-Row, J. Hazard, near Stationer's-Hall, London, and Tho. Hammond, junior in York, 1723.","Latin language, Conversation and phrase books",1,239,Manifest_LitAndLang2,0.004166667,1720,0,"PO, CW",,
5073,1014600100.xml,1014600100,T188154,1771,"The new polite instructor: or, Universal moralist. Consisting of select essays, tales, fables, visions and allegories, for the entertainment and instruction of younger minds. Selected from the most eminent authors.",0,Anon,"London : printed for the booksellers, MDCCLXXI. [1771].","Conduct of life, Juvenile literature",1,309,Manifest_LitAndLang1,0.003225806,1770,0,"SM, CW",,
5088,1018201100.xml,1018201100,T133943,1765,"Paradise lost. A poem, in twelve books. The author John Milton. A new edition. To which is added, the life of the author, by E. Fenton; and a complete index.",0,"Milton, John","Edinburgh : printed for John Wood, at Milton's Head, MDCCLXV. [1765].","Milton, John,, 1608-1674, Biography",1,354,Manifest_LitAndLang1,0.002816901,1760,1,FN,IN,
6260,1018400400.xml,1018400400,T191397,1741,"Histories, or tales of passed times. With morals. Written in French by M. Perrault, and Englished by R. S. gent.",0,"Perrault, Charles","London : printed for R. Montagu, at the Book Ware-House, that End of Great Queen-Street, next Drury-Lane; and J. Pote, at Eton, MDCCXLI. [1741].",Fairy tales,1,188,Manifest_LitAndLang2,0.005291005,1740,1,FN,C,
348,1019200202.xml,1019200202,T167714,1758,The history of Sir Roger and his son Joe. In two volumes. ...,Volume 2,Anon,"London : printed for Francis Noble, at Otway's Head, in King-Street, Covent-Garden; and John Noble, at Dryden's Head, in St. Martin's Court, near Leicester-Square, [1758?].","English fiction, 18th century",1,262,Manifest_HistAndGeo,0.003802281,1750,0,"SM, CW,TY, LB",,
349,1019300401.xml,1019300401,T169564,1785,"Le roi voyageur, ou examen des abus de l'administration de la Lydie. ...",Volume 1,"Perreau, Jean-Andr<c3><a9>","Londres [i.e. Paris?] : chez T. P. Cadel, 1785.","Historical fiction, French, Early works to 1800",1,128,Manifest_HistAndGeo,0.007751938,1780,0,SM,,
6277,1020202300.xml,1020202300,T038822,1775,"The mad pranks of Tom Tram. Son in law to Mother Winter. To which is added, his merry jests, odd conceits, and pleasant tales being very delightful to read.",0,Anon,"Newcastle : printed in this present year, [1775?].","Chapbooks, English",1,26,Manifest_LitAndLang2,0.037037037,1770,0,PO,,
6282,1020203500.xml,1020203500,T056177,1774,Suppl<c3><a9>ment aux r<c3><a9>veries d'un habitant de Lillyput. Traduit du Lillyputien en Francois. Par le Colonel Chev. de Champigny.,0,"Champigny, Jean Bochart, chevalier de","Londres : imprim<c3><a9> aux d<c3><a9>pens de l'auteur, par F. Mesplet, Crown Court, Little Russel Street, Covent Garden, M.DCC.LXXIV. [1774].","Great Britain, Colonies, America, Great Britain, Politics and government, 1760-1789",1,44,Manifest_LitAndLang2,0.022222222,1770,0,LB,,
6319,1023200300.xml,1023200300,T033973,1770,"The folly of wittless women displayed: or the history of the haveral wives, in this town written by Humphrey Clinker, the clashing wives clerk. Being a comical conference between Maggy and Janet; his two auld aunties.",0,"Clinker, Humphrey","Edinburgh : printed for the Company of Flying Stationers, [1770?].","English fiction, Early works to 1800",1,7,Manifest_LitAndLang2,0.125,1770,0,SE,,
6330,1023400701.xml,1023400701,T137673,1786,"Theodosius and Arabella, a novel, in a series of letters, by the late Mrs. Hampden Pye. In two volumes. ...",Volume 1,"Pye, Joel-Henrietta","London : printed for William Lane, 1786.","Epistolary fiction, English, Early works to 1800",1,242,Manifest_LitAndLang2,0.004115226,1780,0,"SE, LB, CW",,
6348,1024500201.xml,1024500201,T190767,1775,"The history of the adventures of Joseph Andrews, and his Friend Mr Abraham Adams. Written in imitation of the manner of Cervantes, Author of Don Quixote. By Henry Fielding, Esq; in two volumes. ...",Volume 1,"Fielding, Henry","London : printed for John Bell, No 132, Strand, M.DCC.LXXV. [1775].","Tobacco, Fiction",1,195,Manifest_LitAndLang2,0.005102041,1770,1,FN,IN,
6353,1024500500.xml,1024500500,T178686,1795,"A new introduction to reading: or, a collection of easy lessons, Arranged on an improved Plan; calculated to acquire with ease a theory of speech, and to facilitate the improvement of youth. Designed as an introduction to The speaker. The fourth edition, corrected. Compiled by the publisher.",0,"Sael, George","London : printed for G. Sael, Newcastle Street, Strand, 1795.","Readers, Early works to 1800, Reading, Early works to 1800",1,188,Manifest_LitAndLang2,0.005291005,1790,0,"BQ, P, TY",,
6363,1027501900.xml,1027501900,T118185,1799,"Biography for boys; or, characteristic histories: calculated to impress the youthful mind with an admiration of virtuous principles, and a detestation of vicious ones. By Mrs. Pilkington.",0,"Pilkington, Mrs. (Mary)","London : printed for Vernor and Hood, No. 31, Poultry, 1799.","English fiction, 18th century",1,224,Manifest_LitAndLang2,0.004444444,1790,0,LS,,
6364,1027600300.xml,1027600300,T223159,1769,"The voyages and adventures of Captain Robert Boyle, in several parts of the world. Intermix'd with the story of Mrs. Villars, an English lady, with whom he made his surprising escape from Barbary. Likewise including the history of an Italian captive, and the life of Don Pedro Aquilo, &c. Full of various and amazing turns of fortune.",0,"Chetwood, W. R. (William Rufus)","London : [s.n.], Printed in the Year MDCCLXIX. [1769].","Voyages, Imaginary",1,278,Manifest_LitAndLang2,0.003584229,1760,0,"TY, LB, CW",,
6365,1027600400.xml,1027600400,T223177,1781,Letters of the late Lord Lyttelton.,0,"Lyttelton, Thomas Lyttelton, Baron","London : printed for J. Bew, in Pater-Noster-Row, MDCCLXXXI. [1781].","Lyttelton, George Lyttelton,, Baron,, 1709-1773, Correspondence, Early works to 1800",1,231,Manifest_LitAndLang2,0.004310345,1780,0,"TY, P, LB, CW",,
6405,1028800102.xml,1028800102,T197760,1755,"Les avantures de Telemaque, fils D'Ulysse. Par Messire Fran<c3><a7>ois de Salignac de la Mothe Fenelon, Precepteur des Enfans de France, & depuis Archeveque-Duc de Cambray, Prince du Saint Empire, &c.",Volume 2,"F<c3><a9>nelon, Fran<c3><a7>ois de Salignac de La Mothe-","Londres : chez R. Ware, T. & T. Longman, C. Hitch & L. Hawes, T. Osborn, J. Beecroft, E. Comyns, J. & J. Rivington, J. Ward, R. Baldwin, & T. Field, 1755.",French fiction,1,208,Manifest_LitAndLang2,0.004784689,1750,0,"SE, SM, CW",,
6409,1030500201.xml,1030500201,T124728,1793,"Matilda Fitz-Aubin, a sketch. In two volumes. ...",Volume 1,Anon,"Dublin : printed for Messrs. P. Wogan, P. Byrne, J. Moore, W. Jones, and J. Rice, 1793.","English fiction, 18th century",1,150,Manifest_LitAndLang2,0.006622517,1790,0,"LS, CW",,
6423,1030800400.xml,1030800400,T070325,1743,"The pleasant, and surprizing adventures of Mr. Robert Drury, during his fifteen years captivity on the island of Madagascar: Containing I. His Voyage to and short Story at the East Indies. II. An Account of the Ship-Wreck of the Degrave, on the Island of Madagascar; the Murder of Captain Younge, and his Ship's Company, except Admiral Bembo's Son, and some few Others, who made their Escape. III. His Captivity, hard Usage, Marriage, and wonderful Variety of Fortune. IV. His Travels thorow the Island, and Description of its Situation, Product, Manufactures, Commodities. &c. V. The Nature of the People, their Customs Wars, Religion and Policy: As also, The Conferences between Some of their Chiefs, and the Author, concerning the Christian, and their Religion. VI. His Redemption from thence by Captain Mackett, late Commander of the Prince of Wales, in the Honourable East India Company's Service: His Arrival to England, and Second Voyage thither. Vii. A Vocabulary of the Madagascar Language. The Whole is a faithful Narrative of Matters of Fact, interspers'd with Variety of amazing Incidents, and illustrated with a Sheet Map of Madagascar, and Cuts. First written by himself, and now carefully revised, and corrected from the Original Copy, with Improvements.",0,"Drury, Robert","London : printed, and sold by W. Meadows, in Cornhill ; T. Astley, in St. Paul's Church-Yard ; and B. Milles, in Hound-Ditch near Bishopsgate, 1743.","Madagascar, Description and travel, Early works to 1800",1,493,Manifest_LitAndLang2,0.002024291,1740,1,BQ,,
6427,1030900300.xml,1030900300,T052971,1758,"Moral and critical reflections on several subjects. Among which (by way of illustration) various characters are occasionally interspersed. By the author of Emily; or, the history of a natural daughter.",0,"Author of Emily; or, the history of a natural daughter","London : printed by Dryden Leach, for F. Noble, at Otway's Head, in King-Street, Covent-Garden; and J. Noble, at Dryden's Head, in St. Martin's-Court, Leicester-Square, MDCCLVIII. [1758].","Ethics, Early works to 1800",1,273,Manifest_LitAndLang2,0.003649635,1750,0,"TY, P, BQ",,
6430,1031000300.xml,1031000300,T095131,1795,"The beauties of history; or, pictures of virtue and vice: drawn from examples of men eminent for their virtues, or infamous for their vices. Selected for the Instruction and Entertainment of Youth. By the late W. Dodd, LL.D. Considerably enlarged.",0,"Dodd, William","London : printed for Vernor and Hood, Birchin Lane, Cornhill, and E. Newbery, Corner of St. Paul's Church-Yard, 1795.","Youth, Conduct of life, Early works to 1800",1,315,Manifest_LitAndLang2,0.003164557,1790,0,SM,,
6445,1034100105.xml,1034100105,T133437,1783,"Le decameron anglois, ou recueil des plus jolis contes, traduits de l'anglois; par Miss Mary Wouters.",Volume 5,"Wouters, Mary","A Londres [i.e. Paris?] : et se trouve <c3><a0> Paris, chez la veuve Ballard & fils, Imp. du Roi, ruc des Mathurins. la veuve Duchesne, Lib. rue Saint-Jacques, M<c3><a9>rigot, L'A<c3><ae>n<c3><a9> Lib. vis-<c3><a0>-vis L'Op<c3><a9>ra.. Renault, Lib. rue S. Jacques, M.DCC.LXXXIII. [1783].","French fiction, 18th century",1,166,Manifest_LitAndLang2,0.005988024,1780,2,FN,C,
6446,1034100106.xml,1034100106,T133437,1783,"Le decameron anglois, ou recueil des plus jolis contes, traduits de l'anglois; par Miss Mary Wouters.",Volume 6,"Wouters, Mary","A Londres [i.e. Paris?] : et se trouve <c3><a0> Paris, chez la veuve Ballard & fils, Imp. du Roi, ruc des Mathurins. la veuve Duchesne, Lib. rue Saint-Jacques, M<c3><a9>rigot, L'A<c3><ae>n<c3><a9> Lib. vis-<c3><a0>-vis L'Op<c3><a9>ra.. Renault, Lib. rue S. Jacques, M.DCC.LXXXIII. [1783].","French fiction, 18th century",1,203,Manifest_LitAndLang2,0.004901961,1780,1,FN,C,
6451,1034200204.xml,1034200204,T140064,1791,"Hermione, or the orphan sisters. A novel. In four volumes. ...",Volume 4,"Lennox, Charlotte","London : printed for William Lane, at the Minerva, 1791.","Epistolary fiction, English, Early works to 1800",1,271,Manifest_LitAndLang2,0.003676471,1790,0,TY,,
6459,1034701100.xml,1034701100,T197950,1784,"A letter to a young gentleman of fortune, just entered at the University.",0,Anon,"Oxford : sold by D. Prince and J. Cooke, MDCCLXXXIV. [1784].","Price, Richard,, 1723-1791, Observations on the nature of civil liberty, Political science",1,38,Manifest_LitAndLang2,0.025641026,1780,0,TY,,
354,1037100602.xml,1037100602,T223099,1754,"Memoires de Justine, ou les confessions d'une fille du monde, qui s'est retir<c3><a9>e en province.",Volume 2,"Magny, Jean Baptiste Michel","Londres [i.e. Paris] : Cbez [sic] Jean Nourse, Libraire, M.DCC.LIV. [1754].","French fiction, 18th century",1,111,Manifest_HistAndGeo,0.008928571,1750,0,"LS, TE",,
6477,1037900103.xml,1037900103,T209773,1792,"Lettres originales de Mirabeau, <c3><a9>crites du donjon de Vincennes, pendant les ann<c3><a9>es 1777, 78, 79 et 80; contenant tous les d<c3><a9>tails sur sa vie priv<c3><a9>e, ses malheurs, et ses amours avec Sophie Ruffei, marquise de Monnier: recueillies par P. Manuel, Citoyen francais.",Volume 3,"Mirabeau, Gabriel-Honor<c3><a9> de Riquetti, comte de","Paris : chez J. B. Garnery, Libraire, rue Serpente, no. 17. A Strasbourg, chez Treuttel, Libraire. A Londres, chez de Boffe, Gerard-Street, no. 7 Solio. 1792, an 30 de la Liberte, [1792].","Mirabeau, Honore<c3><be>-Gabriel de Riquetti,, comte de,, 1749-1791, Correspondence, Early works to 1800, Monnier, Marie The<c3><be>re`se Richard de Ruffey,, marquise de,, 1754-1789, Correspondence, Early works to 1800, Politicians, France, Biography, Early works to 1800, France, Politics and government, 1774-1793",1,602,Manifest_LitAndLang2,0.001658375,1790,0,"TY, LB",,
6479,1038000200.xml,1038000200,T178907,1770,"Miscellanies in prose and verse: selected from Pope, Swift, Addison, Goldsmith, Sterne, Hume, Smollet, Gay, Shenstone, Prior, Murphy, and Brooke. Together with several original pieces never before published.",0,Anon,"Leominster : sold by P. Davis; C. Badham, Hereford; and J. Owen, Ludlow, [1770?].","Penal colonies, New South Wales",1,381,Manifest_LitAndLang2,0.002617801,1770,0,CW,,
6482,1038100500.xml,1038100500,T191405,1712,"The famous and delightful history of Fortunatus, And his Two sons: In Two Parts. Part I. Containing an Account of his Noble Birth, Travels and Adventures, in many strange Lands; how he came by a Purse, which always supplied him with store of Mony, and a Writing-hat, that caused him to be in an instant at any Place he desired to be at; how, at his Death, he bequeathed his Purse and Hat to his two Sons; with his pompous Funeral, Monument and Epitaph. Part II. Containing the Travels and Adventures of Andolocia and Ampeda, Fortunatus's two Sons, with their untimely Deaths, Burials and Epitaphs. and many pleasant Stories added, not being in the former Impressions.",0,Anon,"London : printed by C Brown; and are to be sold by the booksellers of London and Westminster, 1712.","English fiction, 18th century",1,177,Manifest_LitAndLang2,0.005617978,1710,0,"CW, SM",,
6483,1038100600.xml,1038100600,T184976,1778,"The famous history of Valentine and Orson, the two sons of the Emperor of Greece.",0,Anon,"London : printed for J. Bew, No. 28, Pater-Noster-Row, MDCCLXXVIII. [1778].","Chapbooks, Specimens, Early works to 1800, Chivalry, Early works to 1800, Legends, France, Early works to 1800",1,154,Manifest_LitAndLang2,0.006451613,1770,0,"SM, CW, SE",,
6494,1038300900.xml,1038300900,T223105,1784,"Reflections on courtship and marriage: in two letters to a friend. Wherein a practical plan is laid down for observing and securing conjugal felicity. To which is added, A letter to a very young lady on her marriage. By Dr. Swift. Together with two essays on jealousy. By Mr. Addison.",0,"Franklin, Benjamin","London : printed for J. Wren & W. Hodges, MDCCLXXXIV. [1784].",Courtship,1,96,Manifest_LitAndLang2,0.010309278,1780,0,"TY, BQ, P, CW",,
6495,1038400200.xml,1038400200,T177629,1710,"The modern fanatick. Part II. Containing what is necessary to clear all the matters of fact in the first part; and to confute what has been printed in the pretended vindication of Dr. Sacheverell, relating to my self [sic]. ... By William Bisset, ...",0,"Bisset, William","London : printed; and sold by A. Baldwin; and T. Harrison, 1710 [1711].","Sacheverell, Henry,, 1674?-1724",1,37,Manifest_LitAndLang2,0.026315789,1710,1,FN,IN,
6498,1038400701.xml,1038400701,T223107,1800,Henry de Beauvais. A novel. In two volumes. ...,Volume 1,Anon,"Dublin : printed for J. Rice, III, Grafton-Street, 1800.","English fiction, 18th century",1,213,Manifest_LitAndLang2,0.004672897,1800,0,"TE, LB",,
6500,1038400800.xml,1038400800,T223108,1777,"The complete London jester, or, wit's companion: containing all the fun and all the humour, all the Learning and all the Judgment, which have lately flowed from the two universities, from the two theatres, from White's Chocolate-House, from the Bedford Coffee-House; or, from the spouting clubs, and choice spirits clubs in London and Westminster. Including all the Fashionable Jests, Epigrams, Merry Tales. Humorous Jokes, Bon Mots, Conundrums, Irish Bulls, Comical Humbugs, Droll Narrations, Smart Repartees, New Adventures, Funny Epitaphs, and Witticisms. Which will expel Care, drown Grief, banish the Spleen, improve the Wit, create Mirth, entertain Company, and give the Reader a light Heart, and a chearful Countenance. The Whole teaching the agreeable Art of Story-Telling, and furnishing Pieces of Wit, for the Amusement and Improvement of both Sexes.",0,Anon,"London : printed for T. Lowndes, in Fleet-Street, 1777.",English wit and humor,1,141,Manifest_LitAndLang2,0.007042254,1770,1,FN,T,
356,1040000202.xml,1040000202,N031902,1758,"The fortunate country maid. Being the entertaining memoirs of the present celebrated Marchioness of L--- V----: who from a cottage, ... became a lady of the first quality in the court of France, ... From the French of the Chevalier de Mouhy. In two volumes. ...",Volume 2,"Mouhy, Charles de Fieux, chevalier de","London : printed for C. Hitch, B. Dod, R. Ware, W. Needham, R. Baldwin, [and 5 others in London], 1758.","Historical fiction, French, Translations into English, Early works to 1800",1,307,Manifest_HistAndGeo,0.003246753,1750,0,"TY, LB",,
6513,1041600103.xml,1041600103,T194614,1753,The spectator. ... Carefully corrected.,Volume 3,Anon,"Edinburgh : [s.n.], Printed in the Year M.DCC.LIII. [1753].","Great Britain, Politics and government, 1702-1714, Periodicals",1,310,Manifest_LitAndLang2,0.003215434,1750,0,"RQ,TY, LB",,NN
6518,1041700108.xml,1041700108,T194614,1753,The spectator. ... Carefully corrected.,Volume 8,Anon,"Edinburgh : [s.n.], Printed in the Year M.DCC.LIII. [1753].","Great Britain, Politics and government, 1702-1714, Periodicals",1,290,Manifest_LitAndLang2,0.003436426,1750,0,"RQ, LB, SM, CW",,
