,Filename,DocumentID,ESTC_ID,Date,Title,Vol_Number,Author,Imprint,Field_Headings,fn_pages,nofn_pages,TableName,fn.percent,decade,footnotes_present,tags,,
2849,0646300701.xml,646300701,T118919,1783,The two mentors: a modern story. By the author of The old English baron.,Volume 1,"Reeve, Clara","London : printed for Charles Dilly, MDCCLXXXIII. [1783].","Epistolary fiction, English, Early works to 1800",1,311,Manifest_LitAndLang1,0.003205128,1780,0,"BQ, P, TY, CW",,
2851,0646301100.xml,646301100,T040892,1746,"The life, Adventures, And Many and Great Vicissitudes of Fortune of Simon, Lord Lovat, the head of the family of Frasers. From his birth at Beaufort, near Inverness, in the Highlands of Scotland, in 1668, to the time of his being taken by Capt. Millar, after three Days Search, in a hollow Tree, on the Coasts of Knoidart and Arisaig. By the Rev. Archibald Arbuthnot, One of the Society for propagating the Christian Knowledge, and Minister of Kiltarlaty, in the Presbytery of Inverness.",0,"Arbuthnot, Archibald","London : printed and sold (for the author) by R. Walker, in Fleet-Lane; and at his printing-office, next the Theatre Coffee-House in Cambridge, MDCCXLVI. [1746].","Lovat, Simon Fraser,, Lord,, 1667?-1747, Fiction",1,282,Manifest_LitAndLang1,0.003533569,1740,1,"C, T",,
2852,0646400100.xml,646400100,T137685,1759,"Candid: or, all for the best. Translated from the French of M. de Voltaire.",0,Voltaire,"London : printed for J. Nourse at the Lamb opposite Katherine-Street in the Strand, MDCCLIX. [1759].",1759,1,137,Manifest_LitAndLang1,0.007246377,1750,1,C,,
2871,0646600301.xml,646600301,T140069,1742,"Memoirs of a man of quality. Written originally in the French tongue by himself, after his retirement from the world. ...",Volume 1,"Pr<c3><a9>vost, abb<c3><a9>","London : printed for E. Cave, at St. John's Gate, MDCCXLII. [1742].",French fiction,1,303,Manifest_LitAndLang1,0.003289474,1740,1,C,,
2876,0646700202.xml,646700202,T123810,1779,Persian tales designed for use and entertainment. ...,Volume 2,"Facius, J. F. (Johann Friedrich)","Coburg : printed by R.A.W. Ahl, MDCCLXXIX. [1779].","Fairy tales, Early works to 1800",1,156,Manifest_LitAndLang1,0.006369427,1770,1,C,,
2888,0647100102.xml,647100102,T029277,1795,"Julia de Roubign<c3><a9>, a tale. In a series of letters. Published by the author of The man of feeling, and The man of the world. In two volumes. ...",Volume 2,"Mackenzie, Henry","London : printed for A. Strahan, and T. Cadell; and W. Creech at Edinburgh: and sold by T. Cadell jun. and W. Davies, (successors to Mr. Cadell,) in the Strand. MDCCXCV. (drawback.), [1795].","Fathers and daughters, Fiction, Early works to 1800, Married women, Fiction, Early works to 1800, France, Fiction, Early works to 1800",1,195,Manifest_LitAndLang1,0.005102041,1790,1,IN,,
2893,0647100602.xml,647100602,T125276,1705,"The history of the renowned Don Quixote de la Mancha. Written in Spanish, by Miguel de Cervantes Saavedra. Translated from the original by several hands : and publish'd by Peter Motteux. Adorn'd with sculptures.",Volume 2,"Cervantes Saavedra, Miguel de","London : printed for Sam. Buckley, 1705-06.","English fiction, 18th century",1,309,Manifest_LitAndLang1,0.003225806,1700,1,"C, T",,
2898,0652800700.xml,652800700,T063553,1744,Joe Miller's jests.,0,Anon,"[London : s.n., 1744].",English wit and humor,1,117,Manifest_LitAndLang1,0.008474576,1740,2,,,
2907,0653100502.xml,653100502,T086147,1772,"The trial: or, the history of Charles Horton, Esq. By a gentleman. In two volumes. ...",Volume 2,Gentleman,"Dublin : printed for H. Saunders, W. Sleater, J. Potts, J. Williams, T. Walker, R. Moncrieffe, and C. Jenkins, MDCCLXXII. [1772].","[Horton, Charles], Biography, Early works to 1800, Epistolary fiction, English, Early works to 1800",1,197,Manifest_LitAndLang1,0.005050505,1770,1,T,,
178,0655200101.xml,655200101,T117009,1787,"The history of Numa Pompilius, second king of Rome. Translated from the French of Mon. de Florian, by Miss Elizabeth Morgan. And Dedicated, BY Permission, to Her Majesty. ...",Volume 1,Florian,"London : printed for the translator; and sold by T. Cadell, Book Seller, Strand, MDCCLXXXVII. [1787].","Numa Pompilius,, King of Rome,, fl. 715-673 B.C., Fiction",1,175,Manifest_HistAndGeo,0.005681818,1780,0,CW,,
2935,0656400100.xml,656400100,T013864,1785,Fables by the late Mr. Gay. In one volume complete.,0,"Gay, John","London : printed for J. Buckland, A. Strahan, J.F. and C. Rivington, B. White, T. Longman, B. Law, T. Carnan, G. G. J. and J. Robinsons, T. Cadell, S. Bladon, R. Baldwin, J. Sewell, J. Johnson, H. L. Gardner, W. Goldsmith, J. Murray, W. Lowndes G. and T. Wilkie, W. Bent, and E. Newbery, M.DCC.LXXXV. [1785].","Fables, English, Early works to 1800",1,272,Manifest_LitAndLang1,0.003663004,1780,1,IT,,
2950,0657000103.xml,657000103,T073274,1751,"The history of Miss Betsy Thoughtless, in four volumes. ...",Volume 3,"Haywood, Eliza Fowler","London : printed by T. Gardner, and sold at his printing-office at Cowley's-Head, facing St. Clement's Church, in the Strand ; and by all booksellers in town and country, M,D,CC,LI. [1751].",English fiction,1,294,Manifest_LitAndLang1,0.003389831,1750,0,"PO, CW, TY",,
2955,0657000502.xml,657000502,T142951,1775,"Mr. Bentley, the rural philosopher: a tale. In two volumes. ...",Volume 2,"Man, Henry","London : printed for W. Goldsmith, 1775.","English fiction, 18th century",1,235,Manifest_LitAndLang1,0.004237288,1770,0,"CW, TY",,
2958,0657200900.xml,657200900,T096341,1782,"The hermit of Warkworth, a Northumberland ballad. In three fits or cantos.",0,"Percy, Thomas","London : printed for T. Evans in the Strand, M.DCC.LXXXII. [1782].","Warkworth (Northumberland, England)",1,52,Manifest_LitAndLang1,0.018867925,1780,2,,,
2966,0660102100.xml,660102100,T132975,1779,"The death of Abel, in five books. Attempted from the German of Mr. Gessner.",0,"Collyer, Mary","London : printed for S. Toplis and J. Bunney, in St. Paul's Church-Yard; Messrs. Walker and Roberts, in Pater-Noster-Row; and J. Mozley, Gainsbrough, M.DCC.LXXIX. [1779].","Abel, (Biblical figure), Cain, (Biblical figure)",1,172,Manifest_LitAndLang1,0.005780347,1770,0,PB,,
2968,0660200102.xml,660200102,T139665,1799,The gipsy countess: a novel. By Miss Gunning. ...,Volume 2,"Gunning, Miss (Elizabeth)","London : printed for T.N. Longman and O. Rees, 1799.","Epistolary fiction, English, English fiction, 18th century",1,239,Manifest_LitAndLang1,0.004166667,1790,0,CW,,
2975,0660500101.xml,660500101,T029276,1787,"Julia de Roubign<c3><a9>, a tale. In a series of letters. Published by the author of The man of feeling, and The man of the world. In two volumes. ...",Volume 1,"Mackenzie, Henry","London : printed for A. Strahan; T. Cadell, in the Strand; and W. Creech, at Edinburgh, MDCCLXXXVII. [1787].","Fathers and daughters, Fiction, Early works to 1800, Married women, Fiction, Early works to 1800, France, Fiction, Early works to 1800",1,204,Manifest_LitAndLang1,0.004878049,1780,0,CW,,
2977,0660500901.xml,660500901,T107266,1800,"Julia St. Helen; or, the heiress of Ellisborough. A novel: in two volumes. Published by Sarah Cobbe, Relict of the Rev. Richard Chaloner Cobbe, Rector of Bradenham in Buckinghamshire, and Chaplain to the Right Honorable the Earl of Moira. ...",Volume 1,"Cobbe, Sarah","London : printed by J. Nichols, Earl's Court, Leicester-Square; sold by Earle and Hemet, No. 47, Albemarle-Street, Piccadilly, 1800.","Epistolary fiction, English, Early works to 1800",1,247,Manifest_LitAndLang1,0.004032258,1800,0,"TE, TY, O",,
2979,0660601701.xml,660601701,T122020,1757,"Dialogues concerning education. By Mr. David Fordyce, Late Professor of Philosophy of Marishal College, in the University of Aberdeen. ...",Volume 1,"Fordyce, David","London : printed for E. Dilly, at the Rose and Crown in the Poultry, near the Mansion-House, MDCCLVII. [1757].","Education, Early works to 1800",1,437,Manifest_LitAndLang1,0.002283105,1750,3,,,
8406,0661100300.xml,661100300,T039561,1757,"A narrative of facts, Demonstrating the Actual Existence and true Cause of that Physical Confederacy, In Bath, Made known to the Public In the printed Letters of Dr. Lucas and Dr. Oliver. By William Baylies, M. D.",0,"Baylies, William","Bath : printed in the year MDCCLVII. and sold by James Leake, [1757].","Baylies, William,, 1724-1787, Fiction, Early works to 1800, Medical fiction, Early works to 1800",1,57,Manifest_MedSciTech,0.017241379,1750,0,"TY, O",,
190,0662800400.xml,662800400,T135480,1769,"A tale of two swannes. Wherein is comprehended the original and increase of the river Lee, commonly called Ware-River: Together with the Antiquitie of sundrie Places and Townes seated upon the same. Pleasant to be read, and not altogether unprofitable to be understood. By W. Vallans. Publish'd out of the study of Thomas Rawlinson of the Middle-Temple Esq;.",0,"Vallans, William","Oxford : printed at the Theater, MDCCLXIX. [1769].","English fiction, 18th century",1,27,Manifest_HistAndGeo,0.035714286,1760,5,,,
2985,0663901400.xml,663901400,T132015,1795,"The wonderful story teller or new pocket library of agreeable entertainment. Consisting entirely of a great variety of valuable articles not included in the Wonderful magazine: Containing A Miscellaneous Collection Of Remarkable Stories, Surprising Narratives, Wonderful Occurrences, Singular Events, Whimsical Tales, Striking Anccdotes, Miraculous and Heroic Adventures in Human Life, Odd Sayings, Supernatural Visions, Unaccountable Appearances, Absurd Characters, Memorable Exploits, Astonishing Deliverances from Death and various other Dangers, Amusing Histories, Strange Accidents, Extraordinary Memoirs, &c. &c. &c. in the Wonderful Phenomena of Nature. The Whole interspersed with Choice Extracts from the most celebrated Historians, Ancient and Modern; and including many wonderful Stories entirely Original, and founded on well-attested facts. By Walley C. Oulton, Esq. Dedicated to the Numerous Purchasers of the Wonderful Magazine, and the Public at large.",0,"Oulton, Walley Chamberlain","London : published by C. Johnson, No. 14, and sold wholesale and retail by Alex. Hogg, at the King's Arms, No. 16, Paternoster Row; and may be had of all other Booksellers, [1795?].","English literature, 18th century",1,312,Manifest_LitAndLang1,0.003194888,1790,1,"MT, C",,
2991,0664000700.xml,664000700,T070621,1701,"Recueil de lettres fran<c3><a7>ois et anglois. Tir<c3><a9>es des plus cel<c3><a9>bres autheurs fran<c3><a7>ois, ... Avec des reflexions succinctes sur la mani<c3><a8>re d'<c3><a9>crire une lettre. ... A l'usage des Anglois & des e'trangers. Par le Sieur Boyer, Monsieur Sauvage, Monsieur T. Brown, & autres.",0,Anon,"Londres : chez Daniel Brown, George Strahan, & B. Banbury, 1701.","Authors, French, Correspondence",1,332,Manifest_LitAndLang1,0.003003003,1700,1,"C, T",,
2997,0664100400.xml,664100400,T117487,1715,"Wit's cabinet: a companion for gentlemen and ladies. In which is contain'd, I. The interpretation of dreams, according to Artimedorus, and other approved authors. ... X. The art of drinking: or, The school of Bacchus. ... To which is added, a choice collection of the best songs.",0,Anon,"London : printed by T. Norris, at the Looking-glass on London Bridge [1715?].","Dreams, Early works to 1800, English wit and humor, Early works to 1800",1,170,Manifest_LitAndLang1,0.005847953,1710,0,"TY, PB, CW",,
3002,0664500103.xml,664500103,N013499,1794,The rambler. In three volumes. ...,Volume 3,"Johnson, Samuel","London : printed for T. Longman, B. Law and Son, H. Baldwin, C. Dilly, G. G. and J. Robinson, T. Cadell, J. Nichols, F. and C. Rivington, W. Goldsmith, H. Murray, W. Otridge, W. Lowndes, S. Hayes, R. Faulder, G. and T. Wilkie, P. Macqueen, B. Collins, Hookham and Carpenter, Darton and Harvey, Vernor and Hood, Cadell jun. and Davies, and R. Jameson, MDCCXCIV. [1794].","1796, Great Britain, Intellectual life, Great Britain, Social life and customs",1,440,Manifest_LitAndLang1,0.002267574,1790,0,"SM, TY, O",,
3005,0664700701.xml,664700701,T105955,1797,Disobedience. A novel. In four volumes. By the author of Plain sense. ...,Volume 1,"Jacson, Frances","London : printed for William Lane, at the Minerva-Press, Leadenhall-Street, MDCCXCVII. [1797].","English fiction, 18th century",1,268,Manifest_LitAndLang1,0.003717472,1790,0,"SM, CW",,
3007,0664700703.xml,664700703,T105955,1797,Disobedience. A novel. In four volumes. By the author of Plain sense. ...,Volume 3,"Jacson, Frances","London : printed for William Lane, at the Minerva-Press, Leadenhall-Street, MDCCXCVII. [1797].","English fiction, 18th century",1,248,Manifest_LitAndLang1,0.004016064,1790,0,"SM, CW",,
3013,0666502601.xml,666502601,T144082,1783,"Adelaide and Theodore; or letters on education: containing all the principles relative to three different plans of education; to that of Princes, and to those of young Persons of both Sexes. Translated from the French of Madame la Comtesse de Genlis.",Volume 1,"Genlis, St<c3><a9>phanie F<c3><a9>licit<c3><a9>, comtesse de","London : printed for C. Bathurst, in Fleet-Street; and T. Cadell, in the Strand, MDCCLXXXIII. [1783].","Education, Education of princes",1,309,Manifest_LitAndLang1,0.003225806,1780,0,CW,,
3018,0666601901.xml,666601901,T139823,1771,The Idler. In two volumes. ...,Volume 1,Anon,"London : printed for J. Newbery, 1771.","Slackers, Early works to 1800",1,302,Manifest_LitAndLang1,0.00330033,1770,0,"TY, CW, O",,
3023,0670300200.xml,670300200,T096245,1748,"Letters on several subjects. By the late Sir Thomas Fitzosborne, Bart. Published from the copies found among his papers.",0,"Melmoth, William","London : printed for R. Dodsley in Pall-Mall, MDCCXLVIII. [1748].","English letters, Early works to 1800",1,203,Manifest_LitAndLang1,0.004901961,1740,0,"P, BQ, CW, TY, SM",,
3025,0670401000.xml,670401000,T083919,1772,"An introduction to the most useful European languages, consisting of select passages, from the most celebrated English, French, Italian, and Spanish authors. With translations as close as possible; So disposed, in Columns, as to give in one View the Manner of expressing the same Sentence in each Language. Intended for the Use of Foreigners, Merchants, and Gentlemen who make the Knowledge of those Languages their Study. By Joseph Baretti, Secretary for Foreign Correspondence to the Royal Academy of Painting, Sculpture, and Architecture.",0,Anon,"London : printed for T. Davies, in Russel Street, Covent Garden; and T. Cadell, in the Strand, 1772.","French language, Readers, 1500-1800, Italian language, Readers, 1500-1800, Spanish language, Readers, 1500-1800, Languages, Modern, Grammar, Comparative",1,479,Manifest_LitAndLang1,0.002083333,1770,0,"CW, O",,
3028,0670501300.xml,670501300,T154457,1799,Herbier moral ou recueil de fables nouvelles et autres Po<c3><ab>s<c3><a1>ies fugitives par Madame de Genlis.,0,"Genlis, St<c3><a9>phanie F<c3><a9>licit<c3><a9>, comtesse de","Hambourg : chez Pierre Chateauneuf, Librairy. Londres, chez L'Homme, Libraire, No. 93. Newbond-Street, 1799.","Fables, French, Early works to 1800",1,168,Manifest_LitAndLang1,0.00591716,1790,1,"C, IT",,
3032,0671001200.xml,671001200,T048396,1795,"Six satires of Horace, in a style between free imitation and literal version. By William Clubbe, LL. B. Vicar of Brandeston, Suffolk.",0,Horace,"Ipswich : printed and sold by George Jermyn. Sold also by F. and C. Rivington, St. Paul's Church-Yard, and T. Paine, Mewse-Gate, London, MDCCXCV. [1795].","Satire, Latin, Translations into English, Early works to 1800",1,153,Manifest_LitAndLang1,0.006493506,1790,1,IN,,
3035,0675101600.xml,675101600,T123556,1725,"The matchless rogue: or, an account of the contrivances, cheats, stratagems and amours of Tom Merryman, commonly called, Newgate Tom: Who Stiled Himself, Baron of Bridewell, Viscount of New-Prison, Earl of Holborn-Hill, Marquils of Newgate, and Duke of Tyburn. With A particular Detail of his Life and Actions, both Comical and Tragical, from the Time of his Birth in Newgate, to the Hour of his Unhappy Exit at Tyburn.",0,Anon,"London : printed for A. Moore, near St. Paul's, MDCCXXV. [1725].","English fiction, 18th century",1,97,Manifest_LitAndLang1,0.010204082,1720,1,"C, T",,
3038,0675200202.xml,675200202,T130366,1772,"The beauties of English prose: being a select collection of moral, critical, and entertaining passages, disposed in the manner of essays; ... In four volumes. ...",Volume 2,Anon,"London : printed for Hawes Clarke and Collins, S. Crowder, B. Law, and G. Robinson, 1772.","English essays, Early works to 1800",1,264,Manifest_LitAndLang1,0.003773585,1770,0,"TE, CW, TY",,
3044,0681400101.xml,681400101,T139666,1798,The Sicilian. A novel. In four volumes. By the author of The mysterious wife. ...,Volume 1,"Meeke, Mary","London : printed at the Minerva Press, for William Lane, 1798.","English fiction, 18th century",1,353,Manifest_LitAndLang1,0.002824859,1790,1,"C, T",,
3045,0681400102.xml,681400102,T139666,1798,The Sicilian. A novel. In four volumes. By the author of The mysterious wife. ...,Volume 2,"Meeke, Mary","London : printed at the Minerva Press, for William Lane, 1798.","English fiction, 18th century",1,348,Manifest_LitAndLang1,0.00286533,1790,1,"C, T",,
3048,0681500501.xml,681500501,T138872,1767,The history of Alicia Montague. By the author of Clarinda Cathcart. ...,Volume 1,"Marshall, Jane","London : printed for the author: and sold by Robinson and Roberts: Richardson and Urquhart: and T. Cadell, (successor to Mr. Millar), 1767.","Epistolary fiction, English, Early works to 1800",1,280,Manifest_LitAndLang1,0.003558719,1760,0,"PO, CW",,
3049,0681500502.xml,681500502,T138872,1767,The history of Alicia Montague. By the author of Clarinda Cathcart. ...,Volume 2,"Marshall, Jane","London : printed for the author: and sold by Robinson and Roberts: Richardson and Urquhart: and T. Cadell, (successor to Mr. Millar), 1767.","Epistolary fiction, English, Early works to 1800",1,220,Manifest_LitAndLang1,0.004524887,1760,0,CW,,
192,0683500100.xml,683500100,T137681,1768,"L'ingenu: or, the sincere Huron. A true history. Translated from the French of M. de Voltaire.",0,Voltaire,"Glasgow : printed for Robert Urie, MDCCLXVIII. [1768].","Wyandot Indians, Fiction",1,205,Manifest_HistAndGeo,0.004854369,1760,1,T,,
195,0684200201.xml,684200201,N018282,1793,"Gonzalva of Cordova; or, Grenada reconquered. Now first translated from the French of M. Florian. In three volumes. ...",Volume 1,Florian,"London : printed for J. Johnson, 1793.","Granada (Kingdom), History, Fiction, Early works to 1800",1,237,Manifest_HistAndGeo,0.004201681,1790,0,"SM, CW, TY",,
197,0684200203.xml,684200203,N018282,1793,"Gonzalva of Cordova; or, Grenada reconquered. Now first translated from the French of M. Florian. In three volumes. ...",Volume 3,Florian,"London : printed for J. Johnson, 1793.","Granada (Kingdom), History, Fiction, Early works to 1800",1,250,Manifest_HistAndGeo,0.003984064,1790,0,SM,,
3070,0685300703.xml,685300703,T114120,1790,Une ann<c3><a9>e de la vie du chevalier de Faublas. Par M. Louvet de Couvray. ...,Volume 3,"Louvet de Couvray, Jean-Baptiste","Londres [i.e. Paris?] : et se trouve a Paris, chez Bailly. Et chez les marchands de nouveaut<c3><a9>s, 1790.","French fiction, 18th century",1,176,Manifest_LitAndLang1,0.005649718,1790,1,"C, T",,
3078,0685600102.xml,685600102,N004350,1776,"The adventures of Telemachus, the son of Ulysses. Translated from the French of Messire Fran<c3><a7>ois Salignac de la Mothe-Fenelon, Archbishop of Cambray. By T. Smollett, M. D. ...",Volume 2,"F<c3><a9>nelon, Fran<c3><a7>ois de Salignac de La Mothe-","London : printed for S. Crowder, T. Longman, G. Robinson, R. Baldwin, and E. Johnston, MDCCLXXVI. [1776].",French fiction,1,367,Manifest_LitAndLang1,0.002717391,1770,0,"TE, TY, CW",,
3084,0687300601.xml,687300601,T144530,1798,"Clermont. A tale. In four volumes. By Regina Maria Roche, ...",Volume 1,"Roche, Regina Maria","London : printed at the Minerva-Press, for William Lane, 1798.","English fiction, 18th century",1,249,Manifest_LitAndLang1,0.004,1790,0,"BQ, P, CW, TY",,
3092,0687500200.xml,687500200,T147551,1791,"A vocabulary, English and Persian; with introductory grammatical remarks. Compiled for the use of the Hon. East India Company. By Francis Gladwin.",0,"Gladwin, Francis","Calcutta : printed by A. Upjohn, M,DCC,XCI. [1791].","Persian language, Textbooks for foreign speakers, English, Early works to 1800, Persian language, Foreign elements, Arabic, Early works to 1800, Persian language, Vocabulary, Early works to 1800",1,442,Manifest_LitAndLang1,0.002257336,1790,0,"O, TY, PO",,
3103,0688100101.xml,688100101,T029274,1777,"Julia de Roubign<c3><a9>, a tale. In a series of letters. Published by the author of The man of feeling, and The man of the world. In two volumes. ...",Volume 1,"Mackenzie, Henry","London : printed for W. Strahan; and T. Cadell, in the Strand, MDCCLXXVII. [1777].","Fathers and daughters, Fiction, Early works to 1800, Married women, Fiction, Early works to 1800, France, Fiction, Early works to 1800",1,207,Manifest_LitAndLang1,0.004807692,1770,0,CW,,
3105,0688101001.xml,688101001,T073780,1798,"Phedora; or, the forest of Minski. In four volumes. By Mary Charlton. ...",Volume 1,"Charlton, Mary","London : printed at the Minerva Press, for William Lane, Leadenhall-Street, M.DCC.XCVIII. [1798].","English fiction, 18th century",1,314,Manifest_LitAndLang1,0.003174603,1790,1,IT,,
3123,0691900204.xml,691900204,N017023,1773,"The history of Tom Jones, a foundling. In four volumes. By Henry Fielding, Esq;",Volume 4,"Fielding, Henry","London : printed for W. Strahan, J. & F. Rivington, Hawes & Co. W. Johnston, T. Longman, S. Crowder, T. Caslon, E. & C. Dilly, T. Cadell, G. Robinson, T. Becket, T. Davies, T. Lowndes, Richardson & Richardson, and R. Baldwin, MDCCLXXIII. [1773].",English fiction,1,360,Manifest_LitAndLang1,0.002770083,1770,1,C,,
3125,0692100300.xml,692100300,T138462,1750,Hoi tou demosthenous logoi Philippikoi Dodeka. Adjecta est in fine versio latina Wolfii.,0,Demosthenes,"Glasguae : in aedibus academicis excudebant Robertus et Andreas Foulis, Academiae Typographi, M.DCC.L. [1750].","Demosthenes, Fiction, Early works to 1800, Athens (Greece), Politics and government, Fiction, Early works to 1800",1,376,Manifest_LitAndLang1,0.00265252,1750,0,"TY, PB, CW",,
6000,0695300500.xml,695300500,T106393,1775,Genuine memoirs of the Mess. Perreau.,0,Theodosia,"London : printed for G. Kearseley [sic], 1775.","Perreau, Daniel,, d. 1776",1,221,Manifest_LitAndLang2,0.004504505,1770,0,"P, SM, BQ, CW",,
3137,0695800203.xml,695800203,T119086,1784,"Laura and Augustus, an authentic story; in a series of letters, by a young lady. In three volumes.",Volume 3,Young lady,"London : printed for W. Cass, 1784.","Epistolary fiction, English, Early works to 1800",1,158,Manifest_LitAndLang1,0.006289308,1780,0,"CW, TY, PB, O",,
3141,0695901100.xml,695901100,T102097,1729,The craftsman's nosegay.,0,Anon,"London : printed for J. Roberts, near the Oxford-Arms in Warwick-Lane, MDCCXXIX. [1729].","English fiction, 18th century",1,10,Manifest_LitAndLang1,0.090909091,1720,1,IT,,
201,0698100801.xml,698100801,T096749,1761,"The life and extraordinary history of the Chevalier John Taylor. Member of the mostcelebrated Academies, Universities, and Societies of the Learned---Chevalier in several of the first Courts in the World---Illustrious (by Patent) in the Apartments of many of the greatest Princes---Ophthalminter Pontifical, Imperial and Royal---to His late Majesty---to the Pontifical Court---to the Person of Her Imperial Majesty---to the Kings of Poland, Denmark, Sweden, &c. - --to the several Electors of the Holy Empire---to the Royal Infant Duke of Parma---to the Prince of Saxe-Gotha, Serenissime Brother to her Royal Highness the Princess Dowager of Wales---to the Prince Royal of Poland---to the late Prince of Orange---to the present Princes of Bavaria, Modena, Lorrain, Brunswick, Anspach, Bareith, Leige, Salsbourg, Middlebourg, Hesse-Cassel, Holstein, Zerbst, Georgia, &c. - --Citizen of Rome, by a public Act in the Name of the Senate and People---Fellow of that College of Physicians---Professor in Opticles-Doctor in Medicine and Doctor in Chirurgery in several Universities abroad. Who has been on his Travels upwards of thirty Years, with little or no Interruption, during which, he has not only been several Times in every Town in these Kingdoms, but in every Kingdom, Province, State, and City of the least Consideration---in every Court---presented to every Crowned Head and Sovereign Prince in all Europe, without Exception. Containing the greatest Variety of the most entertaining and interesting Adventures, that, 'tis presumed, has ever yet been published in any Country, or in any Language. Written from authentic materials, and published by his son, John Taylor, oculist. In two volumes. ...",Volume 1,"Taylor, John","London : printed for M. Cooper, in Paternoster-Row, MDCCLXI. [1761].","Biographical fiction, English, Early works to 1800",1,243,Manifest_HistAndGeo,0.004098361,1760,1,"C, T",,
3159,0699400401.xml,699400401,T064749,1767,"The history of Miss Clarinda Cathcart, and Miss Fanny Renton. In two volumes. ...",Volume 1,"Marshall, Jane","London : printed for Francis Noble, at his Circulating Library, opposite Gray's-Inn Gate, Holborn; and John Noble, at his Circulating Library, in St. Martin's Court, near Leicester-Square, MDCCLXVII. [1767].","Epistolary fiction, English, Early works to 1800",1,258,Manifest_LitAndLang1,0.003861004,1760,0,"P, BQ, SM, CW, TY",,
