Unnamed: 0,Filename,DocumentID,ESTC_ID,Date,Title,Vol_Number,Author,Imprint,Field_Headings,fn_pages,nofn_pages,TableName,fn.percent,decade,footnotes_present
2215,0033500303.xml,33500303,T071307,1771,"The history of Lady Barton, a novel, in letters, by Mrs. Griffith. In three volumes. ...",Volume 3,"Griffith, Mrs. (Elizabeth)","London : printed for T. Davies, in Russel-Street, Covent-Garden ; and T. Cadell, in the Strand, MDCCLXXI. [1771].","Epistolary fiction, English, 18th century",1,311,Manifest_LitAndLang1,0.003205128,1770,0
2216,0033500400.xml,33500400,T071297,1733,"Friendship in death, in twenty letters from the dead to the living. To which are added, Thoughts on death: translated from the Moral essays of the Messieurs du Port Royal.",0,"Rowe, Elizabeth Singer","London : printed for T. Worrall, at Judge Coke's Head, against St Dunstan's Church in Fleet-Street, [1733].",Immortality,1,478,Manifest_LitAndLang1,0.002087683,1730,0
2217,0033500500.xml,33500500,T012602,1711,The famous history of the valiant London prentice.,0,J. S.,"Newcastle : printed and sold by J. White, 1711.","Chapbooks, English, Early works to 1800",1,25,Manifest_LitAndLang1,0.038461538,1710,0
2218,0033500601.xml,33500601,T070080,1793,"Memoirs of Sir Roger de Clarendon, the natural son of Edward Prince of Wales, commonly called the Black Prince; with anecdotes of many other eminent persons of the fourteenth century. By Clara Reeve. In three volumes. ...",Volume 1,"Reeve, Clara","London : printed for Hookham and Carpenter, Bond-Street, 1793.","Clarendon, Roger,, Sir,, d. 1402",1,247,Manifest_LitAndLang1,0.004032258,1790,0
2221,0036400101.xml,36400101,T107630,1773,"The way to lose him; or, the history of Miss Wyndham. By the author of The way to please him.",Volume 1,Author of The way to please him,"London : printed for F. and J. Noble, at their respective circulating libraries, near Middle Row, Holborn, and Saint Mary's Court, near Leicester Square, MDCCLXXIII. [1773].","[Wyndham,, Miss], Early works to 1800, Epistolary fiction, English, Early works to 1800",1,238,Manifest_LitAndLang1,0.0041841,1770,0
2227,0036400402.xml,36400402,T067336,1792,Anecdotes of the Delborough family. A novel. In five volumes. ... . By Mrs. Gunning.,Volume 2,"Gunning, Mrs. (Susannah)","London : printed for William Lane, at the Minerva Press, Leadenhall-Street, MDCCXCII. [1792].",English fiction,1,228,Manifest_LitAndLang1,0.004366812,1790,0
2231,0036400501.xml,36400501,T108018,1782,Omar and Zemira: an Eastern tale. Founded on the piety of the Asiatics. In two volumes. ...,Volume 1,"Yeo, James","London : printed for H. Goldney, Pater-Noster-Row, MDCCLXXXII. [1782].","English fiction, 18th century",1,218,Manifest_LitAndLang1,0.00456621,1780,0
2232,0036400502.xml,36400502,T108018,1782,Omar and Zemira: an Eastern tale. Founded on the piety of the Asiatics. In two volumes. ...,Volume 2,"Yeo, James","London : printed for H. Goldney, Pater-Noster-Row, MDCCLXXXII. [1782].","English fiction, 18th century",1,171,Manifest_LitAndLang1,0.005813953,1780,0
2234,0036500200.xml,36500200,T001721,1732,"The progress of a harlot. As she is described in Six Prints, by the Ingenious Mr. Hogarth. Containing, I. Her coming to Town. Being met by a Bawd who took her home, and arrested her. II. Her being released by a Jew, who took her into Keeping. III. Her being turned out of Keeping. Her taking Lodgings in Drury-Lane. A Description of the Life led by her, and the rest of the Whores there. IV. Her being sent to Bride-Well, The Trick she put on those who committed her. Her being released. Her Adventure with a Parson whom she pawns for the Reckoning. Her Adventure with a Turkey Merchant. The Trick she play'd two French Refugees and their Wives. Her setting up a Punch-House. The Trick she put on a Widow. V. Her contracting the foul Disease. Her being laid in a Salavation and carried to the famous Lock. The Dispute of the Doctors. Her Death. VI. Her Funeral, with the comical Trick that was play'd the Parson and Undertaker. With several other entertaining Particulars to tedious to be inserted here.",0,Anon,"London : printed for E. Rayner, at the Pamphlet-Shop, next the George-Tavern, Charing-Cross, MDCCXXXII. [1732].","English fiction, 18th century",1,49,Manifest_LitAndLang1,0.02,1730,0
2237,0036500303.xml,36500303,T094332,1799,"The false friend: a domestic story. By Mary Robinson, Author of Poems, Walsingham, Angelina, Hubert de Sevrac, &c. &c. In four volumes. ...",Volume 3,"Robinson, Mary","London : printed for T. N. Longman and O. Rees, Paternoster-Row, 1799.","Epistolary fiction, English, Early works to 1800",1,336,Manifest_LitAndLang1,0.002967359,1790,0
2242,0036600100.xml,36600100,T072274,1722,"The farther adventures of Robinson Crusoe; being the second and last part of his life, and of the strange surprising account of his travels round three parts of the globe. Written by himself.",0,"Defoe, Daniel","London : printed for W. Taylor, at the Ship and Black Swan in Pater-Noster-Row, MDCCXXII. [1722].","British, Foreign countries, Fiction, Early works to 1800, Crusoe, Robinson (Fictitious character), Fiction, Early works to 1800",1,269,Manifest_LitAndLang1,0.003703704,1720,0
2250,0036700101.xml,36700101,T072284,1772,"The life and strange surprising adventures of Robinson Crusoe; of York, mariner: who lived eight and twenty years all alone in an uninhabited island on the coast of America, near the mouth of the great river Oroonoque; having been cast on shore by shipwreck, wherein all the men perished but himself. With an account how he was at last as strangely delivered by pirates. Written by himself. The fourteenth edition, adorned with cuts. In two volumes. ...",Volume 1,"Defoe, Daniel","London : printed for J. Buckland, W. Strahan, J. and F. Rivington, E. Johnson, Hawes, Clarke and Collins, W. Johnston, T. Caslon, T. Longman, B. Law, J. Wilkie, T. Lowndes, W. Nicoll, S. Bladon, and R. Baldwin, MDCCLXXII. [1772].","Survival after airplane accidents, shipwrecks, etc., Fiction",1,296,Manifest_LitAndLang1,0.003367003,1770,0
2252,0036700201.xml,36700201,T085457,1778,"The man of experience; or, the adventures of Honorius. In two volumes, ... . By Mr. Thistlethwaite.",Volume 1,"Thistlethwaite, James","London : printed for John Boosey, at his circulating library, No. 39, King Street, Cheapside, MDCCLXXVIII. [1778].","English fiction, 18th century",1,276,Manifest_LitAndLang1,0.003610108,1770,0
2257,0036700403.xml,36700403,T138326,1799,"Men and manners, a novel. In four volumes. By Francis Lathom, ...",Volume 3,"Lathom, Francis","Dublin : printed by William Porter, for Burnet, Gilbert, Wogan, Colbert, W. Porter [and 5 others in Dublin], 1799.",English fiction,1,154,Manifest_LitAndLang1,0.006451613,1790,0
2258,0036700404.xml,36700404,T138326,1799,"Men and manners, a novel. In four volumes. By Francis Lathom, ...",Volume 4,"Lathom, Francis","Dublin : printed by William Porter, for Burnet, Gilbert, Wogan, Colbert, W. Porter [and 5 others in Dublin], 1799.",English fiction,1,180,Manifest_LitAndLang1,0.005524862,1790,0
2267,0036800503.xml,36800503,T071400,1786,"Juvenile indiscretions. A novel. In five volumes. By the author of Anna, or the Welch heiress. ...",Volume 3,"Bennett, Mrs. (Agnes Maria)","London : printed for W. Lane, Leadenhall Street, MDCCLXXXVI. [1786].","English fiction, 18th century",1,213,Manifest_LitAndLang1,0.004672897,1780,0
2269,0036800505.xml,36800505,T071400,1786,"Juvenile indiscretions. A novel. In five volumes. By the author of Anna, or the Welch heiress. ...",Volume 5,"Bennett, Mrs. (Agnes Maria)","London : printed for W. Lane, Leadenhall Street, MDCCLXXXVI. [1786].","English fiction, 18th century",1,249,Manifest_LitAndLang1,0.004,1780,0
2277,0037000104.xml,37000104,T073510,1794,"Ellen, Countess of Castle Howel, a novel, in four volumes. By Mrs. Bennett. ...",Volume 4,"Bennett, Mrs. (Agnes Maria)","London : printed for William Lane, at the Minerva Press, Leadenhall-Street, MDCCXCIV. [1794].","English fiction, 18th century",1,235,Manifest_LitAndLang1,0.004237288,1790,0
2279,0037000202.xml,37000202,T106128,1786,"The kentish curate; or, the history of Lamuel Lyttleton, a foundling. Written by himself. ...",Volume 2,"Lemoine, Henry","London : printed for J. Parsons, No. 21, Pater-Noster-Row, M,DCC,LXXXVI. [1786].","English fiction, 18th century",1,234,Manifest_LitAndLang1,0.004255319,1780,0
5180,0041800800.xml,41800800,T072322,1785,"The life and most surprizing adventures of Robinson Crusoe, of York, mariner; who lived eight-and-twenty years in an uninhabited island on the coast of America, near the mouth of the great river Oroonoque. With an account of his deliverance thence, and his after Surprizing Adventures. Complete in one volume.",0,"Defoe, Daniel","Chester : printed by J. Fletcher, for T. Craig, in Nantwich, MDCCLXXXV. [1785].","Castaways, Fiction",1,298,Manifest_LitAndLang2,0.003344482,1780,0
5182,0041801000.xml,41801000,T072454,1771,"The generous husband; or, the history of Lord Lelius and the fair Emilia. Containing likewise the genuine memoirs of Asmodei, the pretended Piedmontese Count, from the Time of his Birth, to his Late Ignominious Fall in Hyde Park.",0,Anon,"London : printed for W. Wheeble, opposite the New Church in the Strand, M.DCC.LXXI. [1771].","English fiction, 18th century",1,144,Manifest_LitAndLang2,0.006896552,1770,0
2289,0047101502.xml,47101502,T094338,1794,"The shrine of Bertha: a novel, in a series of letters. In two volumes. By Miss M. E. Robinson. ...",Volume 2,"Robinson, Mary Elizabeth","London : printed for the author, by W. Lane at the Minerva Press, Leadenhall-Street; sold by Scatchard, Paternoster-Row; Miller, Old Bond-Street; Knight and Triphock, Booksellers to his Majesty, St. James's-Street, M.DCC.XCIV. [1794].","Epistolary fiction, English, Early works to 1800",1,235,Manifest_LitAndLang1,0.004237288,1790,0
2300,0048500102.xml,48500102,T107119,1797,"The mysterious wife. A novel, in four volumes. By Gabrielli. ...",Volume 2,"Meeke, Mary","London : printed for William Lane, at the Minerva-Press, Leadenhall-Street, M.DCC.XCVII. [1797].","English fiction, 18th century",1,280,Manifest_LitAndLang1,0.003558719,1790,0
2304,0048500301.xml,48500301,T107267,1797,The posthumous daughter: a novel. In two volumes. ...,Volume 1,Anon,"London : printed and published by G. Cawthorn, British Library, 132, Strand, 1797.","Epistolary fiction, English, Early works to 1800",1,273,Manifest_LitAndLang1,0.003649635,1790,0
2314,0049400302.xml,49400302,T136590,1776,"Pamela; or, virtue rewarded. In a series of familiar letters from a beautiful young damsel to her parents. ... In four volumes.",Volume 2,"Richardson, Samuel","London : printed for W. Strahan, J. F. and C. Rivington, W. Johnston, T. Caslon, S. Crowder [and 11 others in London], 1776.","Master and servant, Fiction",1,406,Manifest_LitAndLang1,0.002457002,1770,0
2319,0049600102.xml,49600102,T072285,1778,"The life and strange surprising adventures of Robinson Crusoe; of York, mariner: who lived eight and twenty years all alone in an uninhabited island on the coast of America, near the mouth of the great river Oroonoque; ... Written by himself. The fifteenth edition, adorned with new cuts. In two volumes. ...",Volume 2,"Defoe, Daniel","London : printed for J. Buckland, W. Strahan, J. F. and C. Rivington, E. Johnson, T. Caslon, T. Longman, B. Law, J. Wilkie, T. Lowndes, W. Nicoll, S. Bladon, and R. Baldwin, 1778.","Survival after airplane accidents, shipwrecks, etc., Fiction",1,282,Manifest_LitAndLang1,0.003533569,1770,0
2324,0049600502.xml,49600502,T055371,1766,The adventures of Roderick Random. In two volumes. ...,Volume 2,"Smollett, Tobias George","London : printed for A. Millar, W. Strahan, J. Rivington, R. Baldwin, W. Johnston, T. Caslon, B. Law, T. Becket and P. A. DeHondt, T. Lowndes, J. Knox, W. Nicoll, T. Durham, and M. Richardson, MDCCLXVI. [1766].","Adventure stories, English, Early works to 1800",1,338,Manifest_LitAndLang1,0.002949853,1760,0
2334,0049800300.xml,49800300,T090533,1725,"Sheppard in <c3><86>gypt, or news from the dead. Being a letter from John Sheppard to Frisky Moll, and his executor. Giving a most entertaining Account of his Arrival and Reception at Styx, with sundry remarkable Adventures as have happened to himself, to Blueskin and Houssare the French Barber, and to many other defunct Robbers, Murderers, and Traitors, &c. Together With the Censures passed on the late Night Scene of Harlequin Sheppard and the Play of Caesar in Aegypt at the Shades. Also a poetic epistle from Charon to Jonathan W-d, with many other curious Particulars.",0,"Sheppard, Jack","London : printed for A. Dodd at the Peacock, and W. Bristowe next the Rose Tavern without Temple-Bar; and sold by the booksellers of London and Westminster, 1725.","Sheppard, Jack,, 1702-1724, Fiction, Allusions in literature",1,29,Manifest_LitAndLang1,0.033333333,1720,0
2378,0055500100.xml,55500100,T139517,1798,The prince of Abissinia. A tale.,0,"Johnson, Samuel","London : printed for F. and C. Rivington, T. N. Longman, G. Wilkie, J. Walker, and Lee and Hurst, MDCCXCVIII. [1798].","Tales, Early works to 1800",1,313,Manifest_LitAndLang1,0.003184713,1790,0
2385,0055500403.xml,55500403,T055357,1784,"The adventures of Peregrine Pickle. In which are included, Memoirs of a lady of quality. ...",Volume 3,"Smollett, Tobias George","London : printed for Joseph Wenman, No. 144, Fleet-Street, MDCCLXXXIV. [1784].","Tobacco, Fiction",1,311,Manifest_LitAndLang1,0.003205128,1780,0
2386,0057700101.xml,57700101,T068573,1791,"The school for widows. A novel. In three volumes. By Clara Reeve, Author of the Old English Baron, &c. &c. ...",Volume 1,"Reeve, Clara","London : printed for T. Hookham, New Bond Street ; Harrison and Co. Paternoster Row ; and W. Miller, Old Bond Street, MDCCXCI. [1791].","Epistolary fiction, English, Early works to 1800",1,289,Manifest_LitAndLang1,0.003448276,1790,0
2387,0057700102.xml,57700102,T068573,1791,"The school for widows. A novel. In three volumes. By Clara Reeve, Author of the Old English Baron, &c. &c. ...",Volume 2,"Reeve, Clara","London : printed for T. Hookham, New Bond Street ; Harrison and Co. Paternoster Row ; and W. Miller, Old Bond Street, MDCCXCI. [1791].","Epistolary fiction, English, Early works to 1800",1,317,Manifest_LitAndLang1,0.003144654,1790,0
2389,0057700200.xml,57700200,T068564,1750,The history of Cornelia.,0,"Scott, Sarah","Dublin : printed for John Smith on the Blind-Quay, M.DCC.L. [1750].","Man-woman relationships, Fiction, Early works to 1800, Women, France, Fiction, Early works to 1800",1,272,Manifest_LitAndLang1,0.003663004,1750,0
2410,0073003000.xml,73003000,T075413,1724,"Lasselia: or, the self-abandon'd. A novel. Written by Mrs. Eliza Haywood.",0,"Haywood, Eliza Fowler","London : printed for D. Browne junr. at the Black-Swan without Temple-Bar; and S. Chapman, at the Angel in Pall-Mall, M.DCC.XXIV. [1724].","English fiction, 18th century",1,84,Manifest_LitAndLang1,0.011764706,1720,0
8521,0130000900.xml,130000900,T065242,1784,Letters from a peeress of England to her eldest son.,0,Peeress of England,"London : printed for J. Debrett (successor to Mr. Almon,) opposite Burlington House, Piccadilly, MDCCLXXXIV. [1784].","Epistolary fiction, 18th century",1,157,Manifest_SSAndFineArt,0.006329114,1780,0
8531,0160001700.xml,160001700,N016104,1766,"The adventure of a bale of goods from America, in consequence of the Stamp Act.",0,Anon,"London : printed for J. Almon, in Piccadilly, 1766.","England and Wales, Test Act 1673, Stamp Act (1765), Fiction, United States, History, Revolution, Causes",1,21,Manifest_SSAndFineArt,0.045454545,1760,0
37,0183400402.xml,183400402,T117366,1789,"Hartly House, Calcutta. In three volumes. ...",Volume 2,Anon,"London : printed for J. Dodsley, 1789.",English fiction,1,168,Manifest_HistAndGeo,0.00591716,1780,0
40,0204700502.xml,204700502,T133187,1787,"Authentic and interesting memoirs of Miss Ann Sheldon; (now Mrs. Archer:) A Lady who figured, during several Years, in the highest Line of public Life, and in whose History will be found, all the Vicissitudes, which so constantly attend on Women of her Description. Written by herself. ...",Volume 2,"Sheldon, Ann","London : printed for the authoress, No 2, St. George's-Place, St George's Fielis; and sold by all the booksellers, M,DCC,LXXXVII. [1787].","[Sheldon, Ann,, fl. 1790], Fiction, Early works to 1800",1,263,Manifest_HistAndGeo,0.003787879,1780,0
47,0214600200.xml,214600200,N021579,1783,School for majesty; or the sufferings of Zomelli. An oriental history.,0,Anon,"London : printed for W. Lane , Leadenhall-Street, M.DCC.LXXXIII. [1783].","English fiction, 18th century",1,137,Manifest_HistAndGeo,0.007246377,1780,0
48,0222100201.xml,222100201,T060052,1800,The history of Emily Montague. In four volumes. By the author of Lady Julia Mandeville. ...,Volume 1,"Brooke, Frances","London : printed for Rd. Dodsley, in Pall-Mall, [1800?].","Quebec (Quebec), History, Fiction",1,239,Manifest_HistAndGeo,0.004166667,1800,0
57,0222500800.xml,222500800,T105166,1759,"The lives and adventures of the most notorious highway-waymen [sic], street robbers and murderers. ...",0,Anon,"London : printed for H. Woodgate and S. Brooke, 1759.","Biographical fiction, English, Early works to 1800",1,119,Manifest_HistAndGeo,0.008333333,1750,0
8533,0241700201.xml,241700201,T119670,1798,"Anecdotes of two well-known families. Written by a descendant; and dedicated to the first female pen in England. Prepared for the press by Mrs. Parsons, ... In three volumes. ...",Volume 1,"Parsons, Mrs. (Eliza)","London : printed for T.N. Longman, 1798.","English fiction, 18th century",1,283,Manifest_SSAndFineArt,0.003521127,1790,0
8534,0241700202.xml,241700202,T119670,1798,"Anecdotes of two well-known families. Written by a descendant; and dedicated to the first female pen in England. Prepared for the press by Mrs. Parsons, ... In three volumes. ...",Volume 2,"Parsons, Mrs. (Eliza)","London : printed for T.N. Longman, 1798.","English fiction, 18th century",1,299,Manifest_SSAndFineArt,0.003333333,1790,0
76,0249000200.xml,249000200,N020515,1799,"The officer's tale: and clergyman's tale: or, history of William Cavendish, and Henry Pembroke. By Sophia and Harriet Lee, Author Of The Recess, Chapter Of Accidents, &c.",0,"Lee, Sophia","Dublin : printed by H. Colbert, 136, Capel-Street, 1799.","Epistolary fiction, English, Early works to 1800",1,283,Manifest_HistAndGeo,0.003521127,1790,0
77,0249300901.xml,249300901,N007095,1793,"The expedition of Humphry Clinker. By Tobias Smollet, M.D. With plates by T. Rowlandson. ...",Volume 1,"Smollett, Tobias George","London : printed for J. Sibbald, and sold by T. Kay, Strand, 1793.","Tobacco, Fiction",1,227,Manifest_HistAndGeo,0.004385965,1790,0
5208,0259200102.xml,259200102,T118881,1794,"Count Roderic's castle: or, Gothic times, a tale. In two volumes. ...",Volume 2,Anon,"London : printed for William Lane, at the Minerva-Press, 1794.","Tales, Early works to 1800",1,249,Manifest_LitAndLang2,0.004,1790,0
5210,0259201000.xml,259201000,T072369,1718,"The lover's week: or, the six days adventures of Philander and Amaryllis. Written by a young lady.",0,"M. H., young lady (Mary Hearne)","London : printed for E. Curll at the Dial and Bible, and R. Francklin at the Sun, both over-against St. Dunstan's Church in Fleet-Street, M.DCC.XVIII. [1718].","Love stories, English, Early works to 1800",1,62,Manifest_LitAndLang2,0.015873016,1710,0
5217,0268400202.xml,268400202,T103378,1797,"Dialogues for Sunday evenings, between the principal lady of the village and her neighbours. Translated from a work of Madame Le Prince de Beaumont, called Magasin des pauvres, &c. &c. With alterations.",Volume 2,"Leprince de Beaumont, Madame (Jeanne-Marie)","London : printed and sold by John Marshall, No. 4, Aldermary Church-Yard, Bow-Lane, and No. 17, Queen-Street, Cheapside, [1797?].","Sunday-evening services, Early works to 1800",1,305,Manifest_LitAndLang2,0.003267974,1790,0
5238,0272700304.xml,272700304,T089849,1780,"Amelia. By Henry Fielding, Esq. In four volumes.",Volume 4,"Fielding, Henry","London : printed for Harrison and Co. No. 18, Paternoster-Row, MDCCLXXX. [1780].","Married women, Fiction, Early works to 1800, England, Fiction, Early works to 1800",1,73,Manifest_LitAndLang2,0.013513514,1780,0
5243,0277100102.xml,277100102,T106576,1770,"Theodora, a novel. By the Right Honourable Lady Dorothea du Bois. In two volumes. ...",Volume 2,"Du Bois, Dorothea","London : printed for the author, by C. Kiernan, in Fullwood's-Rents, Holborn, M.DCC.LXX. [1770].","English fiction, 18th century",1,304,Manifest_LitAndLang2,0.003278689,1770,0
8422,0297600700.xml,297600700,T164758,1763,Advice from a bishop: in a Series of Letters To a Young Clergyman.,0,Bishop,"London : printed for R. and J. Dodsley, in Pall-Mall, MDCCLXIII. [1763].","Clayton, Robert,, 1695-1758, Early works to 1800, Epistolary fiction, Early works to 1800, Ordination, Early works to 1800",1,111,Manifest_RelandPhil,0.008928571,1760,0
82,0301200401.xml,301200401,N010548,1771,"Memoirs of Lady Woodford. Written by herself, and addressed to a friend. In two volumes. ...",Volume 1,"Woodford, Lady","London : printed by George Bigg, for F. and J. Noble, at their respective circulating Libraries, near Middle Row, Holborn, and St. Martin's-Court, near Leicester-Square, MDCCLXXI. [1771].","English fiction, 18th century",1,235,Manifest_HistAndGeo,0.004237288,1770,0
83,0301200402.xml,301200402,N010548,1771,"Memoirs of Lady Woodford. Written by herself, and addressed to a friend. In two volumes. ...",Volume 2,"Woodford, Lady","London : printed by George Bigg, for F. and J. Noble, at their respective circulating Libraries, near Middle Row, Holborn, and St. Martin's-Court, near Leicester-Square, MDCCLXXI. [1771].","English fiction, 18th century",1,217,Manifest_HistAndGeo,0.004587156,1770,0
5266,0324900600.xml,324900600,T096249,1740,"News from the dead, or a faithful and genuine narrative of an extraordinary combat between life and death, exemplified in the case of William Duell, One of the Malefactors who was executed at Tyburn on Monday the 24th of this instant November, for a Rape, Robbery and Murder, and who soon after return'd to life at Barber-Surgeon's-Hall, where he had been brought too from the Place of Execution, in Order to be Anatomiz'd. With a true Account Of all the Particulars that happen'd to him, and the many surprizing Things he saw during the Interval of Time that passed between his being turned off at the Gallows, and his Recovery to Life. The whole taken from his own mouth in Newgate, where he now lies.",0,"Duell, William","London : printed for J. Roberts, at the Oxford-Arms in Warwick-Lane, [1740].","Crime, England, Early works to 1800, Death, Early works to 1800",1,30,Manifest_LitAndLang2,0.032258065,1740,0
5275,0325100101.xml,325100101,T063884,1778,"Letters on the improvement of the mind, addressed to a young lady. In two volumes. By Mrs. Chapone. ...",Volume 1,"Chapone, Mrs. (Hester)","London : printed for J. Walter, at Homer's Head, Charing Cross; and E. and C. Dilly, in the Poultry, MDCCLXXVIII. [1778].","Conduct of life, Early works to 1900",1,206,Manifest_LitAndLang2,0.004830918,1770,0
5296,0327100700.xml,327100700,T119646,1788,"The polite lady; or, a course of female education : in a series of letters, from a mother to her daughter.",0,"Allen, Charles","London [i.e. York?] : printed for A. Millar, W. Law, and R. Cater; and for T. Wilson and R. Spence, York, M,DCC,LXXXVIII. [1788].","Women, Education, Great Britain, Early works to 1800",1,294,Manifest_LitAndLang2,0.003389831,1780,0
5309,0327801200.xml,327801200,T138120,1748,M. T. Ciceronis Academicorum libri duo. Ex editione J. Oliveti.,0,"Cicero, Marcus Tullius","Glasguae : in aedibus academicis excudebant Rob. et And. Foulis, MDCCXLVIII. [1748].","Knowledge, Theory of, Early works to 1800, Philosophy, Early works to 1800",1,155,Manifest_LitAndLang2,0.006410256,1740,0
5320,0331800202.xml,331800202,T107814,1800,"Persian tales, or the thousand and one days. In two volumes. A new edition, embellished with two elegant frontispieces. ...",Volume 2,Anon,"Dublin : printed by D. Graisberry, for G. Burnet; P. Wogan; W. Porter; B. Dornin; J. Rice; H. Fitzpatrick; N. Kelly; R. E. Mercier, and Co.; P. Moore; J. Stockdale; D. Graisberry, 1800.","Tales, Translations into English, Early works to 1800",1,289,Manifest_LitAndLang2,0.003448276,1800,0
5334,0332100800.xml,332100800,T142420,1779,The death of Abel. In five books. Attempted from the German of Mr. Gessner.,0,"Collyer, Mary","Edinburgh : printed for Alexander Donaldson; and sold at his shop, (no. 48), St. Paul's Church-Yard, London; and at Edinburgh, M,DCC,LXXIX. [1779].","Abel, (Biblical figure), Cain, (Biblical figure)",1,199,Manifest_LitAndLang2,0.005,1770,0
5337,0332300102.xml,332300102,T118914,1788,"Features from life; or, a summer visit. By the author of George Bateman, and Maria. In two volumes. ...",Volume 2,"Blower, Elizabeth","London : printed for G. Kearsley, 46, Fleet-Street, M.DCC.LXXXVIII. [1788].","English fiction, 18th century",1,194,Manifest_LitAndLang2,0.005128205,1780,0
5352,0335900903.xml,335900903,T166295,1789,Honoria Somerville: a novel. In four volumes. ...,Volume 3,"Purbeck, Jane","London : printed for G. G. J. and J. Robinson, Pater-Noster-Row, M,DCC,LXXXIX. [1789].","English fiction, 18th century",1,257,Manifest_LitAndLang2,0.003875969,1780,0
5358,0336001203.xml,336001203,N013038,1795,"Robert and Adela: or, the rights of women best maintained by the sentiments of nature. In three volumes. ...",Volume 3,Anon,"London : printed for G. G. and J. Robinson, Pater-Noster-Row, MDCCXCV. [1795].","Epistolary fiction, English, Early works to 1800",1,281,Manifest_LitAndLang2,0.003546099,1790,0
