Unnamed: 0,Filename,DocumentID,ESTC_ID,Date,Title,Vol_Number,Author,Imprint,Field_Headings,fn_pages,nofn_pages,TableName,fn.percent,decade,footnotes_present
4473,0909100302.xml,909100302,T144705,1796,"Camilla: or, a picture of youth. By the author of Evelina and Cecilia. In five volumes. ...",Volume 2,"Burney, Fanny","London : printed for T. Payne; and T. Cadell Jun. and W. Davies (successors to Mr. Cadell), 1796.","English fiction, 18th century",1,434,Manifest_LitAndLang1,0.002298851,1790,0
4475,0909200104.xml,909200104,T144705,1796,"Camilla: or, a picture of youth. By the author of Evelina and Cecilia. In five volumes. ...",Volume 4,"Burney, Fanny","London : printed for T. Payne; and T. Cadell Jun. and W. Davies (successors to Mr. Cadell), 1796.","English fiction, 18th century",1,436,Manifest_LitAndLang1,0.00228833,1790,0
4484,0909600101.xml,909600101,T123792,1786,"Elfrida; or, paternal ambition. A novel. In two volumes. By a lady. ...",Volume 1,Lady,"Dublin : printed by John Rea, for Messrs. White, Byrne, Brown, Moore, Lewis and Halpen, 1786.","Marriage, Fiction",1,289,Manifest_LitAndLang1,0.003448276,1780,0
4498,0912000200.xml,912000200,T117095,1791,"The toast master, being a genteel collection of sentiments + toasts. ...",0,Anon,"[London] : Printed for W. Thiselton, Circulating Library, 37, Goodge Street, Tottenham Court Road, [1791].","Toasts, Early works to 1800",1,52,Manifest_LitAndLang1,0.018867925,1790,0
4503,0912600200.xml,912600200,T097704,1788,Maxims and observations moral and physical: interspersed with characters from the most approved authors.,0,Anon,"London : printed, by J. W. Galabin, Ingram-Court, for J. Bladon, Paternoster-Row, M.DCC.LXXXVIII. [1788].","Maxims, Early works to 1800",1,190,Manifest_LitAndLang1,0.005235602,1780,0
4508,0912800600.xml,912800600,T076085,1789,A father's legacy to his daughters. By the late Dr. Gregory of Edinburgh.,0,"Gregory, John","London : printed for A. Strahan; and T. Cadell, in the Strand, MDCCLXXXIX. [1789].",Young women,1,142,Manifest_LitAndLang1,0.006993007,1780,0
293,0914600500.xml,914600500,T147155,1722,"Gesta Romanorum: containing fifty eight remarkable histories, collected originally from the best and most ancient Roman records. With morals and applications, tending to the Suppressing of vice, and the Encouragement of virtue, and the Love of God. By A. B. Adorn'd with a new set of cuts, proper to Illustrate and Explain the Respective Stories. The Story's pleasant, and the Moral good, If read with Care, and rightly understood.",0,B. P.,"London : printed for T. Norris, at the Looking-Glass on London-Bridge, and A. Bettesworth, at the Red Lion in Pater-Noster-Row, 1722.","Historical fiction, English, Early works to 1800, Latin fiction, Translations into English, Early works to 1800",1,178,Manifest_HistAndGeo,0.005586592,1720,0
295,0914700102.xml,914700102,T139171,1770,"Cyrop<c3><a6>dia: or, the institution of Cyrus. By Xenophon. Translated from the Greek by the Late Honourable Maurice Ashley, Esq; to which is prefixed, a preface, by way of dedication, to the Right Honourable the Lady Elizabeth Harris. ...",Volume 2,Xenophon,"London : printed for Johnson and Payne, No. 8, Paternoster-Row, M,DCC,LXX. [1770].","Greek fiction, Translations into English, Early works to 1800",1,307,Manifest_HistAndGeo,0.003246753,1770,0
301,0915500102.xml,915500102,T107793,1788,"Evelina, or the history of a young lady's entrance into the world. By Miss Burney. ...",Volume 2,"Burney, Fanny","Dresden : printed for C. and F. Walther, M.DCC.LXXXVIII. [1788].","English fiction, 18th century",1,318,Manifest_HistAndGeo,0.003134796,1780,0
4522,0916300202.xml,916300202,T084802,1749,Memoirs of a woman of pleasure. ...,Volume 2,"Cleland, John","London : printed for G. Fenton in the Strand, MDCCXLIX. [1749][1760?].","Erotic stories, English, Early works to 1800, Prostitutes, Fiction, Early works to 1800",1,248,Manifest_LitAndLang1,0.004016064,1740,0
4526,0916700103.xml,916700103,T144630,1783,Theatre of education. Translated from the French of the Countess de Genlis. In four volumes. ...,Volume 3,"Genlis, St<c3><a9>phanie F<c3><a9>licit<c3><a9>, comtesse de","Dublin : printed by D. Graisberry, for Messrs. Whitestone, Walker, Moncrieffe, Beatty, Byrne, Burton and Cash, 1783.","Children's plays, English, Amateur plays, Early works to 1800, Moral education, Early works to 1800",1,285,Manifest_LitAndLang1,0.003496503,1780,0
4527,0916900100.xml,916900100,T081163,1775,"The daughter: or the history of Miss Emilia Royston, and Miss Harriet Ayres; in a series of letters. By the authoress of The exemplary mother.",0,"Cooper, Maria Susanna","London : printed for J. Dodsley in Pall-Mall, MDCCLXXV. [1775].","Epistolary fiction, English, Early works to 1800",1,286,Manifest_LitAndLang1,0.003484321,1770,0
4555,0919701402.xml,919701402,T117246,1767,"The fool of quality, or, the history of Henry Earl of Moreland. In four volumes. ... The second edition. By Mr. Brooke.",Volume 2,"Brooke, Henry","London : printed for W. Johnston, 1767.",English fiction,1,302,Manifest_LitAndLang1,0.00330033,1760,0
8484,0924902502.xml,924902502,T149015,1788,Ouvres badines et morales de Mr Cazotte.,Volume 2,"Cazotte, Jacques","Londres [i.e. Paris?] : [s.n.], 1788.","French fiction, 18th century",1,227,Manifest_RelandPhil,0.004385965,1780,0
6141,0926401500.xml,926401500,N014160,1795,Cheap Repository. The two shoemakers.,0,"More, Hannah","[London] : Sold by J. Marshall, Printer to the Cheap Repository for Moral and Religious Tracts) No. 17, Queen Street, Cheapside, and No. 4, Aldermary Church-Yard, and R. White, Piccadilly, London. By S. Hazard, Printer to the Cheap Repository) at Bath: and by all booksellers, newsmen, and hawkers, in town and country, --- Great Allowance will be made to Shopkeepers and Hawkers. Frice One Penny, Or 4s. 6d. per 100. - 2s. 6d. for 50. - 1s. 6d. for 25. (entered at Stationers Hall.), [1795?].","Chapbooks, English, Specimens, Christian life, Juvenile literature, Pride and vanity, Juvenile literature",1,23,Manifest_LitAndLang2,0.041666667,1790,0
6144,0930901403.xml,930901403,T185414,1799,"Filial indiscretions; or, the female chevalier. In three volumes. ...",Volume 3,Anon,"Wakefield : printed for the author, by Elizabeth Waller, and Rowland Hurst: and sold by G. G. and J. Robinson, Paternoster-Row, London, 1799.","English letters, Early works to 1800",1,191,Manifest_LitAndLang2,0.005208333,1790,0
4616,0936900700.xml,936900700,T147455,1797,"The selector: being a new and chaste collection of visions, tales, and allegories, calculated for the amusement and instruction of the rising generation.",0,Anon,"London : printed for E. Newbery, at the corner of St. Paul's Church-Yard, 1797.","Conduct of life, Juvenile fiction, Early works to 1800",1,227,Manifest_LitAndLang1,0.004385965,1790,0
4625,0937800700.xml,937800700,T163686,1786,"Anecdotes of the late Samuel Johnson, LL.D. during the last twenty years of his life. By Hesther Lynch Piozzi.",0,"Piozzi, Hester Lynch","London : printed for T. Cadell in the Strand, MDCCLXXXVI. [1786].","Johnson, Samuel,, 1709-1784",1,313,Manifest_LitAndLang1,0.003184713,1780,0
4633,0940900200.xml,940900200,T049833,1704,"A tale of a tub. Written for the universal improvement of mankind. To which is added, an account of a battel between the antient and modern books in St. James's library.",0,"Swift, Jonathan","London : printed for John Nutt, near Stationers-Hall, MDCCIV. [1704].","Satire, 18th century",1,324,Manifest_LitAndLang1,0.003076923,1700,0
4636,0941100202.xml,941100202,T066880,1785,Constance: a novel. The first literary attempt of a young lady. In four volumes. ...,Volume 2,"Mathews, Charles, Mrs","London : printed at the Logographic Press, for Thomas Hookham, at his Circulating Library, New Bond-Street, Corner of Bruton-Street, MDCCLXXXV. [1785].","English fiction, 18th century",1,268,Manifest_LitAndLang1,0.003717472,1780,0
4669,0947200602.xml,947200602,T127675,1772,"The history of Sir William Harrington. Written some years since, and revised and corrected by the late Mr Richardson, ... In four volumes. ...",Volume 2,Anon,"London : printed for John Bell, and C. Etherington at York, 1772.","Epistolary fiction, English, Early works to 1800",1,262,Manifest_LitAndLang1,0.003802281,1770,0
4675,0947700201.xml,947700201,T059889,1722,"A select collection of novels in six volumes. Written by the most celebrated authors in several languages. Many of which never appear'd in English before; and all new translated from the originals, by several eminent hands.",Volume 1,"Croxall, Samuel","London : printed for J. Watts; and sold by W. Mears at the Lamb without Temple-Bar, J. Brotherton and W. Meadows at the Black-Bull in Cornhill, W. Chetwood in Russel-Street, Covent-Garden, and J. Lacy at the Ship between the two Temple-Gates, Fleet-Street, MDCCXXII. [1722].","Fiction, Collections",1,395,Manifest_LitAndLang1,0.002525253,1720,0
4710,0951500500.xml,951500500,T199872,1784,"Friendship in death: in twenty letters from the dead to the living. To which are added, letters moral and entertaining, in prose and verse. In three parts. By Mrs. Elizabeth Rowe. To which is prefixed, an account of the life of the author.",0,"Rowe, Elizabeth Singer","London : printed for W. Osborne and T. Griffin, in St. Paul's Church yard, and J. Mozley, Gainsbrough, MDCCLXXXIV. [1784].",Immortality,1,301,Manifest_LitAndLang1,0.003311258,1780,0
4716,0954800401.xml,954800401,T084803,1749,Memoirs of a woman of pleasure. ...,Volume 1,"Cleland, John","London : printed [by Thomas Parker] for G. Fenton [i.e Ralph Griffiths] in the Strand, M.DCC.XLIX. [1749].","Erotic stories, English, Early works to 1800, Prostitutes, Fiction, Early works to 1800",1,225,Manifest_LitAndLang1,0.004424779,1740,0
4734,0957401500.xml,957401500,T053410,1756,"Letters on the most common, as well as important, occasions in life, by Cicero, Pliny, Voiture, Balzac, St. Evremont, Locke, Ld Lansdowne, Temple, Dryden, Garth, Pope, Gay, Swift, Rowe, and other writers of distinguish'd Merit; with many original letters and cards, by the editor. Who has also prefix'd, A Dissertation on the Epistolary Stile; With proper Directions for addressing Persons of Rank and Eminence. For the use of young gentlemen and ladies.",0,"Newbery, John","London : printed for J. Newbery, in St. Paul's Church-Yard, 1756.","English letters, Early works to 1800",1,383,Manifest_LitAndLang1,0.002604167,1750,0
6183,0961600200.xml,961600200,T060642,1772,"The history of female favourites. Of Mary de Padilla, under Peter the Cruel, King of Castile; Livia, under the Emperor Augustus; Julia Farnesa, under Pope Alexander the Sixth; Agnes Soreau, under Charles Vii. King of France; and Nantilda, under Dagobert, King of France.",0,"La Roche-Guihen, Anne de","London : printed for C. Parker, the Upper End of New Bond-Street, M.DCC.LXXII. [1772].","Favorites, Royal, Early works to 1800, Women, Biography, Early works to 1800",1,326,Manifest_LitAndLang2,0.003058104,1770,0
4780,0964700401.xml,964700401,T163567,1779,"The adventures of Peregrine Pickle. In which are included, Memoirs of a lady of quality. By Dr. T. Smollet [sic].",Volume 1,"Smollett, Tobias George","Edinburgh : printed for Alexander Donaldson: and sold at his shop in London; and at Edinburgh, 1779.","Tobacco, Fiction",1,297,Manifest_LitAndLang1,0.003355705,1770,0
4781,0964700402.xml,964700402,T163567,1779,"The adventures of Peregrine Pickle. In which are included, Memoirs of a lady of quality. By Dr. T. Smollet [sic].",Volume 2,"Smollett, Tobias George","Edinburgh : printed for Alexander Donaldson: and sold at his shop in London; and at Edinburgh, 1779.","Tobacco, Fiction",1,307,Manifest_LitAndLang1,0.003246753,1770,0
4782,0964700403.xml,964700403,T163567,1779,"The adventures of Peregrine Pickle. In which are included, Memoirs of a lady of quality. By Dr. T. Smollet [sic].",Volume 3,"Smollett, Tobias George","Edinburgh : printed for Alexander Donaldson: and sold at his shop in London; and at Edinburgh, 1779.","Tobacco, Fiction",1,261,Manifest_LitAndLang1,0.003816794,1770,0
8496,0970700301.xml,970700301,T185631,1779,"The anchoret. A moral tale, in a series of letters. In three volumes.",Volume 1,Anon,"Dublin : printed by and for S. Colbert, (at his circulating library) No. 69, Stephen-Street, MDCCLXXIX. [1779].","Epistolary fiction, English, Early works to 1800",1,90,Manifest_RelandPhil,0.010989011,1770,0
8498,0970700303.xml,970700303,T185631,1779,"The anchoret. A moral tale, in a series of letters. In three volumes.",Volume 3,Anon,"Dublin : printed by and for S. Colbert, (at his circulating library) No. 69, Stephen-Street, MDCCLXXIX. [1779].","Epistolary fiction, English, Early works to 1800",1,63,Manifest_RelandPhil,0.015625,1770,0
4797,0971500201.xml,971500201,T177358,1788,"The reflector. A selection of Essays on Various Subjects of Common Life. From original papers. Illustrated with entertaining anecdotes. I love to write, to speak myself as plain As honest Skippen or downright Montaigne. Pope. Difficile est non scribere. Juv. ...",Volume 1,Anon,"London : printed for W. Lane, Leadenhall-Street, MDCCLXXXVIII. [1788].","Conduct of life, Early works to 1800",1,221,Manifest_LitAndLang1,0.004504505,1780,0
4813,0976200300.xml,976200300,T138064,1742,"Erasmi Colloquia selecta: or, the select colloquies of Erasmus. With an English translation, as literal as possible, design'd for the use of beginners in the Latin Tongue. The ninth edition. By John Clarke, Author of the Essays upon Education and Study.",0,"Erasmus, Desiderius","London : printed for C. Hitch, at the Red-Lion in Pater-Noster-Row; and sold by T. Hammond in York; and J. Mace, and J. Munby, in Hull, 1742.","Latin language, Conversation and phrase books",1,230,Manifest_LitAndLang1,0.004329004,1740,0
4831,0983300900.xml,983300900,W020094,1798,"Cynthia, with the tragical account of the unfortunate loves of Almerin and Desdemona: being a novel. Illustrated with a variety of the chances of fortune; moralized with many useful observations, whereby the reader may reap both pleasure and profit.",0,Anon,"[Northampton] : Printed at Northampton, Massachusetts by William Butler, M,DCC,XCVIII. [1798].","English fiction, 18th century",1,111,Manifest_LitAndLang1,0.008928571,1790,0
4835,0983500300.xml,983500300,T105851,1780,"The speaker: or, miscellaneous pieces, selected from the best English writers, and disposed under proper heads, with a view to facilitate the improvement of youth in reading and speaking. To which is prefixed, an essay on elocution. By William Enfield, LL. D. Lecturer on the Belles Lettres in the Academy at Warrington.",0,"Enfield, William","London : printed for Joseph Johnson, St. Paul's Church-Yard, MDCCLXXX. [1780].","Elocution, Great Britain, Politics and government, 1702-1714, Periodicals",1,440,Manifest_LitAndLang1,0.002267574,1780,0
329,0984600202.xml,984600202,T127124,1799,"Destination: or, memoirs of a private family. By Clara Reeve, ... In three volumes. ...",Volume 2,"Reeve, Clara","London : printed for T.N. Longman and O. Rees, 1799.","English fiction, 18th century",1,223,Manifest_HistAndGeo,0.004464286,1790,0
330,0984600203.xml,984600203,T127124,1799,"Destination: or, memoirs of a private family. By Clara Reeve, ... In three volumes. ...",Volume 3,"Reeve, Clara","London : printed for T.N. Longman and O. Rees, 1799.","English fiction, 18th century",1,221,Manifest_HistAndGeo,0.004504505,1790,0
331,0984900101.xml,984900101,T057311,1766,"The fool of quality; or, the history of Henry Earl of Moreland. In four volumes. ... By Mr. Brooke.",Volume 1,"Brooke, Henry","London : printed for W. Johnston, 1766-69.",English fiction,1,301,Manifest_HistAndGeo,0.003311258,1760,0
332,0984900102.xml,984900102,T057311,1766,"The fool of quality; or, the history of Henry Earl of Moreland. In four volumes. ... By Mr. Brooke.",Volume 2,"Brooke, Henry","London : printed for W. Johnston, 1766-69.",English fiction,1,298,Manifest_HistAndGeo,0.003344482,1760,0
333,0984900103.xml,984900103,T057311,1766,"The fool of quality; or, the history of Henry Earl of Moreland. In four volumes. ... By Mr. Brooke.",Volume 3,"Brooke, Henry","London : printed for W. Johnston, 1766-69.",English fiction,1,294,Manifest_HistAndGeo,0.003389831,1760,0
335,0984900105.xml,984900105,T057311,1766,"The fool of quality; or, the history of Henry Earl of Moreland. In four volumes. ... By Mr. Brooke.",Volume 5,"Brooke, Henry","London : printed for W. Johnston, 1766-69.",English fiction,1,298,Manifest_HistAndGeo,0.003344482,1760,0
4860,0989700101.xml,989700101,T093499,1766,"Letters on different subjects, in four volumes; amongst which are interspers'd the adventures of Alphonso, after the destruction of Lisbon. By the author of The unfortunate mother's advice to her absent daughters. ...",Volume 1,"Pennington, Sarah, Lady","London : to be had by the subscribers at those booksellers where they have subscribed, and at W. Bristow's late shop in St. Paul's Church Yard, or at his house in Roll's Buildings, Fetter-Lane, M.DCC.LXVI. [1766]-67.","English letters, Early works to 1800",1,202,Manifest_LitAndLang1,0.004926108,1760,0
4861,0989700102.xml,989700102,T093499,1766,"Letters on different subjects, in four volumes; amongst which are interspers'd the adventures of Alphonso, after the destruction of Lisbon. By the author of The unfortunate mother's advice to her absent daughters. ...",Volume 2,"Pennington, Sarah, Lady","London : to be had by the subscribers at those booksellers where they have subscribed, and at W. Bristow's late shop in St. Paul's Church Yard, or at his house in Roll's Buildings, Fetter-Lane, M.DCC.LXVI. [1766]-67.","English letters, Early works to 1800",1,202,Manifest_LitAndLang1,0.004926108,1760,0
4865,0989800202.xml,989800202,T211455,1785,The rambler. In four volumes. ...,Volume 2,"Johnson, Samuel","Dublin : printed by D. Graisberry, for J. Jones, No. 39, College-Green, MDCCLXXXV. [1785].","English literature, 18th century, 1796",1,307,Manifest_LitAndLang1,0.003246753,1780,0
4866,0989800203.xml,989800203,T211455,1785,The rambler. In four volumes. ...,Volume 3,"Johnson, Samuel","Dublin : printed by D. Graisberry, for J. Jones, No. 39, College-Green, MDCCLXXXV. [1785].","English literature, 18th century, 1796",1,322,Manifest_LitAndLang1,0.003095975,1780,0
6208,0990200202.xml,990200202,T200450,1710,"The tatlers. By Isaac Bickerstaff, Esq;",Volume 2,"Steele, Richard, Sir","London : printed and sold by H. Hills, in Black-Fryars, near the Water-Side, 1710.","English fiction, 18th century",1,297,Manifest_LitAndLang2,0.003355705,1710,0
4882,0992001200.xml,992001200,T129874,1797,"The improvement of time, for the instruction of children.",0,Anon,"London : printed for the proprietor & sold by Darton & Harvey, Gracechurch Street, 1797.","English fiction, 18th century",1,79,Manifest_LitAndLang1,0.0125,1790,0
4894,0998700400.xml,998700400,T133044,1800,"The governess; or, evening amusements, at a boarding school.",0,Anon,"London : printed for Vernor and Hood, Poultry, and sold by E. Newbery, ST. Paul's Church-Yard; by Tegg and Dewick, Westmoreland Buildings, Aldersgate Street, 1800.",Children's stories,1,234,Manifest_LitAndLang1,0.004255319,1800,0
4910,0999100301.xml,999100301,T208530,1796,"The hermit of Caucasus, an oriental romance. In two volumes. By Joseph Moser, Author of Turkish Tales, &c. &c. ...",Volume 1,"Moser, Joseph","London : printed for William Lane, at the Minerva-Press, Leadenhall-Street, M.DCC.XCVI. [1796].","Love stories, English, Early works to 1800",1,265,Manifest_LitAndLang1,0.003759398,1790,0
4914,0999201002.xml,999201002,T211732,1793,"The bastard of Normandy, a tale, on the banks of the Seine. In two volumes. By the author of Tancred, a tale of ancient times. ...",Volume 2,"Fox, Joseph, novelist","London : printed for the author, and sold by Hookham & Carpenter, Bond-Street, [1793].","Tales, Early works to 1800",1,117,Manifest_LitAndLang1,0.008474576,1790,0
4915,0999201102.xml,999201102,T208539,1793,The history of Philip Waldegrave. In two volumes. ...,Volume 2,"Towers, Joseph","London : printed for T. Evans, No. 46, Paternoster-Row, MDCCXCIII. [1793].","English fiction, 18th century",1,212,Manifest_LitAndLang1,0.004694836,1790,0
8577,1003601700.xml,1003601700,T108216,1702,"The parliament of criticks, the Menipp<c3><a6>an satyr of Justus Lipsius in a dream; paraphras'd: in a banter upon the criticks of the age.",0,"Lipsius, Justus","London : printed for J. Hartley, next Door to the King's-Head-Tavern in Holborn, 1702.","English fiction, 18th century",1,106,Manifest_SSAndFineArt,0.009345794,1700,0
4937,1003900300.xml,1003900300,T118434,1769,"The compleat tutor. Being the second part to the Child's compleat tutor. Consisting, I. Of Words of Four, Five, Six, and Seven Syllables. II. Tables of the most usual Scripture names, with their Signification. - Of the usual Proper Names of Men and Women, and their Signification. III. Of Letters in general; of Diphthongs Tripthongs, with the Division of Syllables. IV. A Table of Words, the same, or nearly alike in Sound, but different in Sense and Spelling. V. The Use of Stops and Marks in Writing, and a List of Abbrevations, with their Explanations. VI. Treating on Grammar in general. Vii. Of Figures and Numerals. To which is added, select fables in prose and verse. Intended for the use of schools. By John Jones, Usher in Bromsgrove Free-School.",0,"Jones, John, usher in Bromsgrove Free-School","Worcester : printed for S. Gamidge, at Prior's Head, [1769].","English language, Grammar, Early works to 1800, English language, Orthography and spelling, Early works to 1800",1,95,Manifest_LitAndLang1,0.010416667,1760,0
4938,1003900400.xml,1003900400,T118608,1777,The history of little Goody Two-Shoes; otherwise called Mrs. Margery two-shoes. ...,0,"Pennington, Sarah, Lady","London : printed for T. Carnan and F. Newbery, 1777.","English fiction, 18th century",1,160,Manifest_LitAndLang1,0.00621118,1770,0
4946,1004100900.xml,1004100900,T126577,1718,"The lover's week: or, the six days adventures of Philander and Amaryllis. Written by a young lady.",0,"M. H., young lady (Mary Hearne)","London : printed for E. Curll at the Dial and Bible, and R. Francklin at the Sun, both over-against St. Dunstan's Church in Fleet-Street, M.DCC.XVIII. [1718].","Love stories, English, Early works to 1800",1,62,Manifest_LitAndLang1,0.015873016,1710,0
4947,1004101000.xml,1004101000,T137687,1790,"The pleasing companion, a collection of fairy tales, calculated to improve the heart: The Whole Forming A System Of Moral Precepts and Examples, For The Conduct Of Youth through Life: Containing Princess Hebe & Anguiletta Graciosa and Percinet Story of Finetta Princess Carpilona Story of the White Cat Yellow Dwarf Pidgeon and Dove Young and Handsome Ornamented with elegant cuts.",0,Anon,"London : printed for W. Lane, Leadenhall-Street, [1790?].","Fairy tales, Early works to 1800",1,298,Manifest_LitAndLang1,0.003344482,1790,0
4960,1004500201.xml,1004500201,T055294,1753,The adventures of Ferdinand Count Fathom. By the author of Roderick Random. In two volumes. ...,Volume 1,"Smollett, Tobias George","London : printed for W. Johnston, at the Golden Ball in St. Paul's Church-Yard, MDCCLIII. [1753].","Adventure stories, English, Early works to 1800",1,270,Manifest_LitAndLang1,0.003690037,1750,0
4969,1007300302.xml,1007300302,T060739,1799,A tale of the times. By the author of A gossip's story. Dedicated by Permission to Mrs. Carter. In three volumes. ...,Volume 2,"West, Mrs. (Jane)","London : printed for T. N. Longman and O Rees, Paternoster-Row, 1799.","Wollstonecraft, Mary,, 1759-1797, Parodies, imitations, etc.",1,314,Manifest_LitAndLang1,0.003174603,1790,0
4970,1007300303.xml,1007300303,T060739,1799,A tale of the times. By the author of A gossip's story. Dedicated by Permission to Mrs. Carter. In three volumes. ...,Volume 3,"West, Mrs. (Jane)","London : printed for T. N. Longman and O Rees, Paternoster-Row, 1799.","Wollstonecraft, Mary,, 1759-1797, Parodies, imitations, etc.",1,387,Manifest_LitAndLang1,0.00257732,1790,0
4971,1007400201.xml,1007400201,T055366,1748,The adventures of Roderick Random. In two volumes. ...,Volume 1,"Smollett, Tobias George","London : printed for J. Osborn, in Pater-Noster-Row, MDCCXLVIII. [1748].","Adventure stories, English, Early works to 1800",1,345,Manifest_LitAndLang1,0.002890173,1740,0
5026,1012600300.xml,1012600300,T178781,1768,"The polite instructor; or, youth's museum. Consisting of moral essays, tales, fables, visions, and allegories. Selected from the most approved modern authors. With an introduction, containing rules for reading with elegance and propriety. To the whole is added, a collection of letters. With some rules prefixed, useful for supporting a genteel epistolary correspondence.",0,Anon,"Dublin : printed by John Exshaw, in Dame-Street, MDCCLXVIII. [1768].","Letter writing, Early works to 1800, Moral education, Early works to 1800, Young men, Conduct of life, Early works to 1800, Young women, Conduct of life, Early works to 1800, Young men, Intellectual life, Early works to 1800, Young women, Intellectual life, Early works to 1800",1,264,Manifest_LitAndLang1,0.003773585,1760,0
6240,1012800201.xml,1012800201,T189423,1790,The expedition of Humphry Clinker. By the author of Roderick Random. In two volumes. ...,Volume 1,"Smollett, Tobias George","Dublin : printed by the United Company of Book-Sellers, 1790.","Tobacco, Fiction",1,226,Manifest_LitAndLang2,0.004405286,1790,0
5038,1013400500.xml,1013400500,T181356,1796,"Queen Mab; or fairy adventures: being a series of incidents wonderful and surprising: in which are painted the happiness attendant on virtue, and the punishment that necessarily follows vice, illustrated by Example.",0,Anon,"London : printed for William Lane, at the Minerva-Press, Leadenhall-Street, MDCCXCVI. [1796].","English fiction, 18th century",1,134,Manifest_LitAndLang1,0.007407407,1790,0
